"","Hash","BestTaxon","HaplotypeNumber","Tax_list","Mismatches","BlastTaxIDs","LCA_taxid","Kingdom","Phylum","Class","Order","Family","Genus","Species","AccessionNumbers","Max_pident","Sequence","DateAdded"
"55","31f27164e4850e08a80c68a3e444229821e22b14","Stichaeidae",3,"Bryozoichthys lysimus, Chirolophis decoratus;Chirolophis nugator, Chirolophis japonicus, Chirolophis wui, Chirolophis ascanii, Eumesogrammus praecisus, Opisthocentrus ocellatus, Pholidapus dybowskii, Ulvaria subbifurcata, Stichaeus punctatus, Xiphister atropurpureus, Alectrias alectrolophus, Chirolophis saitonis, Askoldia variegata, Phytichthys chirus, Xiphister mucosus, Leptoclinus maculatus, Alectrias benjamini, Apodichthys flavidus, Anisarchus medius, Ernogrammus hexagrammus, Poroclinus rothrocki, Lumpenella longirostris, Xenolumpenus longipterus, Stichaeopsis nevelskoi, Anisarchus macrops","1, 3, 4, 5","1317002 320615 433395",476938,"Eukaryota","Chordata","Actinopteri","Perciformes","Stichaeidae","","","gi|985566734|dbj|LC069669.1|, gi|985563325|dbj|LC092008.1|",99.387,"CACCGCGGTTATACGAGAGACCCAAGTTGACAGACATCGGCGTAAAGAGTGGTTAAGTTAGAATTTGTACTAAAGCCGAACGTCCTCAAGGCTGTTATACGCACCCGAAGATAAGAAGTTCAACCACGAAGGTGGCTTTATTTAGTCTGAACCCACGAAAGCT","2025-08-12"
"56","320906204027b69e786c66cac26de8b8ee4f1943","Artedius fenestralis",1,"Artedius fenestralis, Artedius lateralis","1, 14","274758",274758,"Eukaryota","Chordata","Actinopteri","Perciformes","Cottidae","Artedius","Artedius fenestralis","gi|985563227|dbj|LC091910.1|, gi|669175196|gb|KM057943.1|",99.387,"CACCGCGGTTATACGAGTGGCCCAAGTTGACAGACACTCGGCGTAAAACGTGGCTAGGCTAAACACTCAAACTAAAGCCGAACACCTTCTAAGCTGTGATACGCAATCGAAGGCAGGAAGCCCCACCACGAAAGTGGCTTTAACCTGAGCTCAACCCACGAAA","2025-08-12"
"57","326a7c9731a234206f492fcd11d4c0257f513af6","Oncorhynchus",1,"Oncorhynchus mykiss, Oncorhynchus mykiss nelsoni, Oncorhynchus chrysogaster, Oncorhynchus gilae, Oncorhynchus mykiss gairdneri, Oncorhynchus clarkii lewisi, Oncorhynchus mykiss irideus, Oncorhynchus mykiss newberrii, Oncorhynchus gilae apache, Oncorhynchus nerka, Oncorhynchus clarkii henshawi, Oncorhynchus mykiss x Salmo salar, Oncorhynchus kawamurae","1, 0, 2","8022 3030642 648071 64185 857570 490388 857569 2978582 209197",8016,"Eukaryota","Chordata","Actinopteri","Salmoniformes","Salmonidae","Oncorhynchus","","gi|2812967822|gb|PQ284210.1|, gi|2812967808|gb|PQ284209.1|, gi|2812967724|gb|PQ284203.1|, gi|1352192337|gb|KY798500.1|, gi|1276392030|gb|MF621750.1|, gi|2714808899|gb|PP620833.1|, gi|2449539989|gb|OP902891.1|, gi|2715299418|ref|NC_087622.1|, gi|770591431|gb|KP013084.1|, gi|2445527499|gb|OQ301638.1|, gi|2675382884|dbj|LC799144.1|, gi|815248813|dbj|LC050735.1|, gi|2305126263|gb|OK637252.1|, gi|2305126232|gb|OK637248.1|, gi|2305126187|gb|OK623665.1|, gi|2305126172|gb|OK623662.1|, gi|2305126143|gb|OK583899.1|, gi|2305126099|gb|OK040162.1|, gi|2305125701|gb|OK623679.1|, gi|2067616704|gb|MZ567214.1|, gi|1953426706|gb|MW300342.1|, gi|1953426622|gb|MW300336.1|, gi|1953426608|gb|MW300335.1|, gi|2088241430|ref|NC_056957.1|, gi|1935001868|gb|MT667254.1|, gi|1896498849|gb|MT410879.1|, gi|82492328|gb|DQ288271.1|, gi|82492314|gb|DQ288270.1|, gi|82492300|gb|DQ288269.1|, gi|4927735|gb|AF125509.1|AF125509, gi|4927734|gb|AF125508.1|AF125508, gi|4808821|gb|AF113121.1|AF113121, gi|4808820|gb|AF113120.1|AF113120",99.387,"CACCGCGGTTATACGAGAGGCCCTAGTTGATAACTACCGGCGTAAAGAGTGGTTATGGAAAGATATTTAATAAAGCCGAACACCCCCTCAGCCGTCATACGCACCTGGGAGCACGAAGACCTACTGCGAAAGCAGCTTTAACTATGCCTGACCCCACGACAGC","2025-08-12"
"58","34fcc17885999fc2ed6da861b861057ed089b970","Apodichthys flavidus",2,"Apodichthys flavidus, Bryozoichthys lysimus, Chirolophis decoratus;Chirolophis nugator, Eumesogrammus praecisus, Opisthocentrus ocellatus, Pholidapus dybowskii, Xenolumpenus longipterus, Pholis crassispina, Ulvaria subbifurcata, Askoldia variegata, N/A, Dinogunellus grigorjewi, Anisarchus medius, Chirolophis japonicus, Pholis crassispina;Pholis picta;Pholis clemensi, Poroclinus rothrocki, Lumpenella longirostris, N/A;Stichaeus sp. HUMZ:205628;Dinogunellus grigorjewi, Chirolophis wui, Stichaeopsis nevelskoi, Pholis picta, Alectrias benjamini, Anisarchus macrops, Chirolophis ascanii, Leptoclinus maculatus","1, 3, 4, 5, 6","57779",57779,"Eukaryota","Chordata","Actinopteri","Perciformes","Pholidae","Apodichthys","Apodichthys flavidus","gi|985563339|dbj|LC092022.1|, gi|2314982008|ref|NC_066931.1|",99.387,"CACCGCGGTTATACGAGAGGCCCAAGTTGACAGACATCGGCGTAAAGAGTGGTTAAGTTGAATTTGTACTAAAGCCGAACACCCTCAAGGCTGTTATACGCACCCGAAGACAAGAAGTTCAACCACGAAGGTGGCTTTATTTAGTCTGAACCCACGAAAGCTG","2025-08-12"
"59","3544eefc9799f76657169df50406b3fa1c9ceff5","Pholis",3,"Pholis ornata, Pholis gunnellus, Pholis laeta, Pholis crassispina;Pholis picta;Pholis clemensi, Pholis crassispina, Pholis picta, Pholis nebulosa, Lumpenella longirostris, Anisarchus medius, Eumesogrammus praecisus, Zaprora silenus, Stichaeopsis epallax, Stichaeus punctatus, Pholidapus dybowskii, Askoldia variegata, Opisthocentrus ocellatus, Bryozoichthys lysimus, Chirolophis decoratus;Chirolophis nugator, Poroclinus rothrocki, Xenolumpenus longipterus, Alectrias benjamini, Anisarchus macrops","1, 2, 3, 4, 5, 6","283028 56726",56725,"Eukaryota","Chordata","Actinopteri","Perciformes","Pholidae","Pholis","","gi|985563335|dbj|LC092018.1|, gi|2314982022|ref|NC_066932.1|, gi|1515576542|gb|MH377827.1|",98.78,"CACCGCGGTTATACGAGAGGCCCAAGTTGACAGACATCGGCGTAAAGAGTGGTTAAGTTAAACTGTACTAAAGCCGAACATCCTCCAGGCTGTTATACGCATCCGAAGATAAGAAGTTCAACCACGAAAGTAGCTTTATTTAGTCTGAACCCACGAAAGCTAC","2025-08-12"
"60","35b2f3ad01fa4d5a142dce4c61329e01ae02450d","Homo sapiens",1,"Homo sapiens","0","9606",9606,"Eukaryota","Chordata","Mammalia","Primates","Hominidae","Homo","Homo sapiens","gi|70956158|gb|DQ112912.3|, gi|70956156|gb|DQ112911.2|, gi|70956152|gb|DQ112909.3|, gi|70956150|gb|DQ112908.2|, gi|70956148|gb|DQ112907.2|, gi|70956144|gb|DQ112905.2|, gi|70956140|gb|DQ112903.2|, gi|70956138|gb|DQ112902.2|, gi|70956134|gb|DQ112900.2|, gi|70956096|gb|DQ112881.2|, gi|70956032|gb|DQ112849.2|, gi|70956024|gb|DQ112845.2|, gi|70955926|gb|DQ112796.2|, gi|70955922|gb|DQ112794.2|, gi|70955898|gb|DQ112782.2|, gi|70955890|gb|DQ112778.2|, gi|70955852|gb|DQ112759.2|, gi|70955850|gb|DQ112758.2|, gi|70955816|gb|DQ112741.2|, gi|70955808|gb|DQ112737.2|, gi|70955804|gb|DQ112735.2|, gi|70955800|gb|DQ112733.2|, gi|70955796|gb|DQ112731.2|, gi|70955794|gb|DQ112730.2|, gi|70955788|gb|DQ112727.2|, gi|70955784|gb|DQ112725.3|, gi|70955782|gb|DQ112724.3|, gi|70955780|gb|DQ112723.2|, gi|70955752|gb|DQ112709.2|, gi|70955750|gb|DQ112708.2|, gi|70955746|gb|DQ112706.2|, gi|70955744|gb|DQ112705.2|, gi|70955742|gb|DQ112704.2|, gi|70955740|gb|DQ112703.2|, gi|70955738|gb|DQ112702.2|, gi|70955736|gb|DQ112701.2|, gi|70955734|gb|DQ112700.2|, gi|70955732|gb|DQ112699.2|, gi|70955730|gb|DQ112698.2|, gi|70955728|gb|DQ112697.3|, gi|70955726|gb|DQ112696.3|, gi|70955724|gb|DQ112695.3|, gi|70955722|gb|DQ112694.2|, gi|70955720|gb|DQ112693.2|, gi|70955718|gb|DQ112692.2|, gi|70955716|gb|DQ112691.2|, gi|70955714|gb|DQ112690.2|, gi|29294532|gb|AF381994.2|, gi|29294531|gb|AF381992.2|, gi|17985375|gb|AF381981.1|",100,"CACCGCGGTCACACGATTAACCCAAGTCAATAGAAGCCGGCGTAAAGAGTGTTTTAGATCACCCCCTCCCCAATAAAGCTAAAACTCACCTGAGTTGTAAAAAACTCCAGTTGACACAAAATAAACTACGAAAGTGGCTTTAACATATCTGAACACACAATAG","2025-08-12"
"61","35b9638a3fbc3b69a527ba1e3a212c03ee087512","Clupea pallasii",14,"Clupea pallasii, Sprattus muelleri, Sprattus antipodum, Ethmidium maculatum","1, 2, 11, 12, 13","30724",30724,"Eukaryota","Chordata","Actinopteri","Clupeiformes","Clupeidae","Clupea","Clupea pallasii","gi|985566912|dbj|LC091579.1|",99.387,"CACCGCGGTTATACGAGAGACCCTAGTTGATATACTCGGCGTAAAGAGTGGTTATGGAAAACAAGCACTAGAGCCAAAGAGCCCTCAGGCCGTTATACGCACCCGGGGCCTCGAACCACTATCACGAAAGTAGCTTTACCCCCGCCCACCAGAACCCACGAGA","2025-08-12"
"62","38959e4a86ebff826cca050a0d0ce35facd846c8","Liparis",1,"Liparis fucensis, Liparis dennyi, Liparis gibbus, Liparis ochotensis, Liparis agassizii, Liparis bathyarcticus, Liparis fabricii, Liparis inquilinus, Liparis tessellatus, Rhinoliparis barbulifer, Liparis cyclopus, Liparis tanakae, Nectoliparis pelagicus, Liparis mucosus, Paraliparis dipterus, Paraliparis rosaceus, Lipariscus nanus, Rhinoliparis attenuatus, Liparis miostomus, Rhodichthys regina, Paraliparis meridionalis, Paraliparis cephalus, Careproctus cyclocephalus, Careproctus sp. OCF-P20080722-1, Paraliparis copei, Psednos melanocephalus, Polypera greeni","3, 4, 5, 7, 8, 9, 10, 11, 12, 13","433401 433403",183716,"Eukaryota","Chordata","Actinopteri","Perciformes","Liparidae","Liparis","","gi|985563671|dbj|LC104586.1|, gi|985563670|dbj|LC104585.1|, gi|985563665|dbj|LC104580.1|",98.16,"CACCGCGGTTATACGAGAGGCCCAAGTTGAAAGACACCGGCGTAAAGCGTGGTTAAGCTAAAATTTAAATTAAAGTTAAACATCTTCAAGGCTGTTATACGCACCCGAAGGCAGGAGCCTCAATTACGAAAGTAACTTTATACAAGCTGAACCCACGAAAGCT","2025-08-12"
"63","3a5dbc8011b81312ae2434d18bb7725731fc5dc0","Clupea pallasii",15,"Clupea pallasii","2, 3, 0","30724",30724,"Eukaryota","Chordata","Actinopteri","Clupeiformes","Clupeidae","Clupea","Clupea pallasii","gi|117671448|gb|DQ912047.1|",100,"CACCGCGGTTATACGAGAGGCCCTAGTTGACATACTCGGCGTAAAGAGTGGTTATGGAAAACAAGCACTAAAGCCAAAGAGCCCTCAGGCCGTTATACGCACCCGGGGCCTCGAACCACTATCACGAAAGTAGCTTTACCCTCGCCCACCAGAACCCACGAGA","2025-08-12"
"64","3ad1f7f63c9f3eda50ff396bd1ed3846f41808e9","Oligocottus",2,"Oligocottus maculosus;Oligocottus snyderi","1","328410 459052",328409,"Eukaryota","Chordata","Actinopteri","Perciformes","Cottidae","Oligocottus","","gi|985563225|dbj|LC091908.1|",99.387,"CACCGCGGTTATACGAGAGGCCCAAGTTGACAGATGCCGGCGTAAAACGTGGCTAGACTGAGCCCCAACTAAAGCCAAACACCTTCAAAGCTGTGATACGCAAACGAAGGCAGGAAATACTACCACGAAAGTGGCTTTATCCAATTTGAACCCACGAAAGCTA","2025-08-12"
"65","3b7ed0643e50cd0a3e1c8cd4f20fa32d7985297e","Gadus",2,"Gadus chalcogrammus, Gadus macrocephalus, Gadus ogac, Gadus finnmarchicus, Boreogadus saida","0, 1, 2","1042646 80720",8048,"Eukaryota","Chordata","Actinopteri","Gadiformes","Gadidae","Gadus","","gi|1783586359|gb|MH035595.1|, gi|1783586345|gb|MH035594.1|, gi|1347724927|ref|NC_036931.1|, gi|1096114933|dbj|AP017650.1|, gi|985567160|dbj|LC091827.1|, gi|821091570|gb|KP644356.1|, gi|2222646889|gb|OM174271.1|",100,"CACCGCGGTTATACGAGAGGCCCAAATTGATGAAAAACGGCGTAAAGCGTGGTTAAGAAAAAAGAGAAAATATGGCCGAACAGCTTCAAAGCAGTTATACGCATCCGAAGTCACGAAGAACAATCACGAAAGTTGCCCTAAAACCTCCGATTCCACGAAAGCC","2025-08-12"
"66","3cc42f8cf0957ba4bef1aea9198bc612db5029ec","Clupea pallasii",16,"Clupea pallasii, Sprattus muelleri, Sprattus antipodum, Ethmidium maculatum","1, 2, 10, 11","30724",30724,"Eukaryota","Chordata","Actinopteri","Clupeiformes","Clupeidae","Clupea","Clupea pallasii","gi|1848856272|dbj|LC552350.1|, gi|985564913|dbj|LC020932.1|, gi|148922558|ref|NC_009578.1|",99.387,"CACCGCGGTTATACGAGAGACCCTAGTTGATATACTCGGCGTAAAGAGTGGTTATGGAAAACAAGTACTAAAGCCAAAGAGCCCTCAGGCCGTTATACGCACCCGGGGCCTCGAACCACTATCACGAAAGTAGCTTTACCCTCGCCCACCAGAACCCACGAGA","2025-08-12"
"67","3d456e01a681fefe989d0e229cc8e5f250a376bc","Clupea pallasii",17,"Clupea pallasii, Sprattus muelleri, Sprattus antipodum, Ethmidium maculatum","1, 2, 10, 11, 12","30724",30724,"Eukaryota","Chordata","Actinopteri","Clupeiformes","Clupeidae","Clupea","Clupea pallasii","gi|1848856272|dbj|LC552350.1|, gi|985564913|dbj|LC020932.1|, gi|148922558|ref|NC_009578.1|",99.387,"CACCGCGGTTATACGAGAGACCCTAGTTGATATACTCGGCGTAAAGAGTGGTTATGGAAAACAAGCACTAAAGCCAAAGAGCCCTCAGGCCGTTATACGCATCCGGGGCCTCGAACCACTATCACGAAAGTAGCTTTACCCTCGCCCACCAGAACCCACGAGA","2025-08-12"
"68","3d4ee85c85eb9fe0a4d0b2b773fbc1292dc925de","Bos taurus",1,"Bos taurus","0","9913",9913,"Eukaryota","Chordata","Mammalia","Artiodactyla","Bovidae","Bos","Bos taurus","gi|37791027|gb|AY337527.1|, gi|37791025|gb|AY337525.1|, gi|37791024|gb|AY337524.1|, gi|37791023|gb|AY337523.1|, gi|37791022|gb|AY337522.1|, gi|37791021|gb|AY337521.1|, gi|37791020|gb|AY337520.1|, gi|56411146|gb|AY676873.1|, gi|56411132|gb|AY676872.1|, gi|56411118|gb|AY676871.1|, gi|56411104|gb|AY676870.1|, gi|56411062|gb|AY676867.1|, gi|56411048|gb|AY676866.1|, gi|56411034|gb|AY676865.1|, gi|56411020|gb|AY676864.1|, gi|56411006|gb|AY676863.1|, gi|56410992|gb|AY676862.1|, gi|56410978|gb|AY676861.1|, gi|56410964|gb|AY676860.1|, gi|56410936|gb|AY676858.1|, gi|56410922|gb|AY676857.1|, gi|56410908|gb|AY676856.1|, gi|56410894|gb|AY676855.1|, gi|42521312|gb|AY526085.1|, gi|27543989|dbj|AB074968.1|, gi|27543975|dbj|AB074967.1|, gi|27543961|dbj|AB074966.1|, gi|27543947|dbj|AB074965.1|, gi|27543933|dbj|AB074964.1|, gi|27543919|dbj|AB074963.1|, gi|27543905|dbj|AB074962.1|, gi|2042119403|gb|MT576810.1|, gi|2158467723|gb|MZ901598.1|, gi|33321661|gb|AF492351.1|, gi|28189990|dbj|AB099145.1|, gi|28189984|dbj|AB099139.1|, gi|28189980|dbj|AB099135.1|, gi|28189975|dbj|AB099130.1|, gi|28189964|dbj|AB099119.1|, gi|28189958|dbj|AB099113.1|, gi|28189956|dbj|AB099111.1|, gi|28189950|dbj|AB099105.1|, gi|28189949|dbj|AB099104.1|, gi|28189948|dbj|AB099103.1|, gi|28189410|dbj|AB098880.1|, gi|28189404|dbj|AB098874.1|, gi|28189401|dbj|AB098871.1|, gi|28189395|dbj|AB098865.1|, gi|28189382|dbj|AB098853.1|, gi|28189374|dbj|AB098845.1|",100,"CACCGCGGTCATACGATTAACCCAAGCTAACAGGAGTACGGCGTAAAACGTGTTAAAGCACCATACCAAATAGGGTTAAATTCTAACTAAGCTGTAAAAAGCCATGATTAAAATAAAAATAAATGACGAAAGTGACCCTACAATAGCCGACGCACTATAGCTA","2025-08-12"
"69","3e0ba91c0ea5e358c5c90421813949d89db23282","Pleuronectidae",2,"Parophrys vetulus, Isopsetta isolepis, Psettichthys melanostictus, Platichthys stellatus, Myzopsetta ferruginea, Platichthys flesus, Lepidopsetta polyxystra, Liopsetta glacialis, Platichthys stellatus x Verasper variegatus, Lepidopsetta bilineata, Lepidopsetta mochigarei, Platichthys stellatus x (Kareius bicoloratus x Platichthys stellatus), Kareius bicoloratus x Platichthys stellatus, Platichthys stellatus;Liopsetta pinnifasciata;Platichthys stellatus x Parophrys vetulus, Pleuronectes quadrituberculatus, Limanda aspera, Glyptocephalus zachirus, Glyptocephalus stelleri, Glyptocephalus zachirus;Glyptocephalus stelleri, Kareius bicoloratus, Hippoglossoides elassodon;Acanthopsetta nadeshnyi;Hippoglossoides robustus, Pseudopleuronectes americanus, Hippoglossoides platessoides","1, 2, 3","172659 195617 195639",8256,"Eukaryota","Chordata","Actinopteri","Pleuronectiformes","Pleuronectidae","","","gi|2373975304|gb|OP035309.1|, gi|2571476604|gb|OR499737.1|, gi|2569353389|gb|OR482580.1|, gi|2587926803|ref|NC_082806.1|, gi|1018242347|dbj|LC145941.1|, gi|1018242344|dbj|LC145938.1|, gi|1018242343|dbj|LC145937.1|, gi|1018242342|dbj|LC145936.1|, gi|1018242331|dbj|LC145925.1|, gi|1018242330|dbj|LC145924.1|, gi|1018241275|dbj|LC145950.1|, gi|2314981994|ref|NC_066930.1|, gi|22532245|gb|AF488485.1|, gi|22532241|gb|AF488481.1|",99.387,"CACCGCGGTTATACGAGAGGCCCAAGTTGACAAACAACGGCGTAAAGAGTGGTTAGGGGATTTAATAAACTAGAGCCGAACGCTTTCAAAGCTGTTATACGCACCCGAAAGTATGAAACACAATTACGAAAGTAGCTCTACCTATCCTGAACCCACGAAAGCT","2025-08-12"
"70","3e13506b56b845ef97ff5e2da232d7ace410bde0","Pleuronichthys coenosus",1,"Pleuronichthys coenosus, Pleuronichthys verticalis, Pleuronichthys japonicus, Pleuronichthys cornutus, Hypsopsetta guttulata, Eopsetta jordani, Myzopsetta punctatissima, Pseudopleuronectes yokohamae, Pseudopleuronectes herzensteini, Pseudopleuronectes herzensteini;Pseudopleuronectes yokohamae, Lepidopsetta polyxystra, Lepidopsetta bilineata, Pleuronectes quadrituberculatus, Limanda aspera, Lepidopsetta mochigarei, Pseudopleuronectes schrenki, Pseudopleuronectes obscurus, Pseudopleuronectes americanus;Pseudopleuronectes obscurus, Hippoglossus stenolepis, Hippoglossoides elassodon;Acanthopsetta nadeshnyi;Hippoglossoides robustus, Pleuronichthys cornutus;Pleuronichthys lighti, Pleuronichthys lighti, Pseudopleuronectes americanus, Hippoglossoides platessoides","0, 1, 11, 10, 13, 14, 15","269452",269452,"Eukaryota","Chordata","Actinopteri","Pleuronectiformes","Pleuronectidae","Pleuronichthys","Pleuronichthys coenosus","gi|2587933674|ref|NC_083045.1|, gi|1018242326|dbj|LC145920.1|, gi|1018242325|dbj|LC145919.1|",100,"CACCGCGGTTATACGAGAGGCCCAAGTTGACAGACAACGGCGTAAAGAGTGGTTAGGGAACAAATTAAAATAGAGCCAAACGCTTTCACAGCTGTTATACGCACCCGAGAGTATGAAACCCAATCACGAAAGTAACTCTACTAACCCTGAGCCCACGAAAGCT","2025-08-12"
"71","3f073e740aad6a1d63125c310ec9cf23e5a36c9a","Clupea pallasii",18,"Clupea pallasii, Sprattus muelleri, Sprattus antipodum, Ethmidium maculatum","1, 2, 10, 11, 12","30724",30724,"Eukaryota","Chordata","Actinopteri","Clupeiformes","Clupeidae","Clupea","Clupea pallasii","gi|1848856272|dbj|LC552350.1|, gi|985564913|dbj|LC020932.1|, gi|148922558|ref|NC_009578.1|",99.387,"CACCGCGGTTATACGAGAGACCCTAGTTGATATACTCGGCGTAAAGAGTGGTTATGGAAAACAAGCACTAAAGCCAAAGAGCCCTCAGGCCGTTATACGCACCCGGGGCCTCGAACCACTATCACGAAAGTAGCTTTACCCCCGCCCACCAGAACCCACGAGA","2025-08-12"
"72","3fc69aacdc88a5b40701fc5b627ecec4c4388f27","Gadus chalcogrammus",1,"Gadus chalcogrammus, Gadus finnmarchicus, Gadus macrocephalus, Boreogadus saida, Gadus ogac","1, 2, 3, 4","1042646",1042646,"Eukaryota","Chordata","Actinopteri","Gadiformes","Gadidae","Gadus","Gadus chalcogrammus","gi|1783586443|gb|MH035601.1|, gi|985567156|dbj|LC091823.1|, gi|821091571|gb|KP644357.1|",99.387,"CACCGCGGTTATACGAGAGGCCCAAATTGATGAAATACGGCGTAAAGCGTGGTTAAGAAAAAGAGAGAAAATATGGCCGAACAGCTTCAAAGCAGTTATACGCATCCGAAGTCACGAAGAACAATCACGAAAGTTGCCCTAAAACCTCCGATTCCACGAAAGC","2025-08-12"
"73","40a8bf8fbef45f219035bf52ec2fed57eba0045f","Clupea pallasii",19,"Clupea pallasii, Sprattus muelleri, Sprattus antipodum, Ethmidium maculatum","1, 2, 10, 11, 12","30724",30724,"Eukaryota","Chordata","Actinopteri","Clupeiformes","Clupeidae","Clupea","Clupea pallasii","gi|1848856272|dbj|LC552350.1|, gi|985564913|dbj|LC020932.1|, gi|148922558|ref|NC_009578.1|",99.387,"CACCGCGGTTATACGAGAGACCCTAGTTGATATACTCGGCGTAAAGAGTGGTTATGGTAAACAAGCACTAAAGCCAAAGAGCCCTCAGGCCGTTATACGCACCCGGGGCCTCGAACCACTATCACGAAAGTAGCTTTACCCTCGCCCACCAGAACCCACGAGA","2025-08-12"
"74","416ce163d06cddfe37dd6c2659d106efcf87a24e","Artedius harringtoni",3,"Artedius harringtoni, Artedius lateralis","1, 12","433399",433399,"Eukaryota","Chordata","Actinopteri","Perciformes","Cottidae","Artedius","Artedius harringtoni","gi|985563237|dbj|LC091920.1|",99.387,"CACCGCGGTTATACGAATGGCCCAAGTTGACAGATACTCGGCGTAAAACGTGGCTAAGTCATACACTCACACTAAAGCCAAACACCTTCAAGGCTGTTATACGCAACCGAAGGCAGGAAGTCCCTCCACGAAAGTGGCTTTACCTTATCTGAGCCCACGAAAG","2025-08-12"
"75","43a1606bc821185bcd0a1ea30f543b4b599f5a36","Homo",1,"Homo sapiens, Gorilla beringei, Gorilla beringei graueri","5, 6","9606",9606,"Eukaryota","Chordata","Mammalia","Primates","Hominidae","Homo","","gi|2067827322|gb|MN628164.1|, gi|2067827308|gb|MN628163.1|, gi|2067827266|gb|MN628160.1|, gi|2067827252|gb|MN628159.1|, gi|2067827154|gb|MN628152.1|, gi|2067827042|gb|MN628144.1|, gi|2067827014|gb|MN628142.1|, gi|2067827000|gb|MN628141.1|, gi|2067826986|gb|MN628140.1|, gi|2067826930|gb|MN628136.1|, gi|2067826888|gb|MN628133.1|, gi|2067826776|gb|MN628125.1|, gi|2067826762|gb|MN628124.1|, gi|2067826748|gb|MN628123.1|, gi|2067826734|gb|MN628122.1|, gi|2067826706|gb|MN628120.1|, gi|2067826692|gb|MN628119.1|, gi|2067826678|gb|MN628118.1|, gi|2067826664|gb|MN628117.1|, gi|2067826650|gb|MN628116.1|, gi|2067826636|gb|MN628115.1|, gi|2067826594|gb|MN628112.1|, gi|2067826566|gb|MN628110.1|, gi|2067826552|gb|MN628109.1|, gi|2067826538|gb|MN628108.1|, gi|2067825768|gb|MN628053.1|, gi|2067825754|gb|MN628052.1|, gi|2067825740|gb|MN628051.1|",96.341,"CACCGCGGTCACACGATTAACCCAAGTCAATAGAAACCGGCGTAAAGAGTGTTTTAGATCAATTCCCCTCAATAAAGCTAAAATTCACCTGAGTTGTAAAAAACTCCAGTTGATACAAAATAAACTACGAAAGTGGCTTTAACGCATCTGAACACACAATAGC","2025-08-12"
"76","444b59571da507d178256e98c84cd4e19817ff61","Clupea pallasii",20,"Clupea pallasii, Sprattus muelleri, Sprattus antipodum, Ethmidium maculatum","1, 2, 10, 11, 13","30724",30724,"Eukaryota","Chordata","Actinopteri","Clupeiformes","Clupeidae","Clupea","Clupea pallasii","gi|1848856272|dbj|LC552350.1|, gi|985564913|dbj|LC020932.1|, gi|148922558|ref|NC_009578.1|",99.387,"CACCGCGGTTATACGAGAGACCCTAGTTGATATACTCGGCGTAAAGAGTGGTTATGGAAAACAAGCACTAAAGCCAAAGAGCCCTCAGGCCGTTATACGCACCCGGGGCCTCGAACCACTGTCACGAAAGTAGCTTTACCCTCGCCCACCAGAACCCACGAGA","2025-08-12"
"77","44815c29e2956d55acdd216661fc6d2c1f273d43","Liparis",2,"Liparis fucensis, Liparis dennyi, Liparis gibbus, Liparis ochotensis, Liparis bathyarcticus, Liparis agassizii, Liparis fabricii, Liparis inquilinus, Liparis tessellatus, Rhinoliparis barbulifer, Liparis cyclopus, Liparis tanakae, Nectoliparis pelagicus, Liparis mucosus, Paraliparis dipterus, Paraliparis rosaceus, Lipariscus nanus, Rhinoliparis attenuatus, Liparis miostomus, Rhodichthys regina, Paraliparis meridionalis, Paraliparis cephalus, Careproctus cyclocephalus, Careproctus sp. OCF-P20080722-1, Paraliparis sp. NSMT P92399, Polypera greeni, Liparis punctulatus","2, 3, 4, 5, 6, 7, 8, 9, 10, 11, 12","433401 433403 255718 1642177",183716,"Eukaryota","Chordata","Actinopteri","Perciformes","Liparidae","Liparis","","gi|985563671|dbj|LC104586.1|, gi|985563670|dbj|LC104585.1|, gi|985563665|dbj|LC104580.1|, gi|1825511891|gb|MT103919.1|, gi|1825511890|gb|MT103918.1|, gi|1825511889|gb|MT103917.1|, gi|1327757072|gb|MG718032.1|, gi|2580315378|gb|OR582696.1|, gi|985566364|dbj|LC049942.1|",98.773,"CACCGCGGTTATACGAGAGGCCCAAGTTGAAAGACACCGGCGTAAAGCGTGGTTAAGCTAAAATTTAAATTAAAGTTAAACATCTTCAAGGCTGTTATACGCACCCGAAGACAGGAGCCTCAATTACGAAAGTAACTTTATACAAGCTGAACCCACGAAAGCT","2025-08-12"
"78","44bd9b2b51e6ce3c4de7913b073e9562c3b70fed","Polypera greeni",1,"Polypera greeni, Liparis cyclopus, Liparis florae, Liparis miostomus, Liparis tanakae, Liparis tessellatus, Liparis ochotensis, Rhinoliparis barbulifer, Liparis gibbus, Liparis bathyarcticus, Nectoliparis pelagicus, Paraliparis dipterus, Paraliparis rosaceus, Lipariscus nanus, Liparis fabricii, Liparis inquilinus, Rhinoliparis attenuatus, Paraliparis meridionalis, Paraliparis cephalus, Liparis agassizii, Careproctus sp. OCF-P20080722-1, Liparis mucosus, Paraliparis sp. NSMT P92399, Psednos groenlandicus, Liparis fucensis, Liparis dennyi, Careproctus roseofuscus, Careproctus marginatus, Liparis punctulatus","0, 5, 8, 6, 7, 9, 10, 11, 12, 13","1562383",1562383,"Eukaryota","Chordata","Actinopteri","Perciformes","Liparidae","Polypera","Polypera greeni","gi|985563662|dbj|LC104577.1|, gi|985563661|dbj|LC104576.1|",100,"CACCGCGGTTATACGAGAGGCCCAAGTTGAAAGACACCGGCGTAAAGCGTGGTTAAGTTAAAATTTTAAGCTAAAGTTAAACATCTTCAAGACTGTTATACGTGTACGAAGACAGGAGCCTCAACTACGAAAGTGACTTTACACAAGCTGAACCCACGAAAGC","2025-08-12"
"79","44f90bbdaa161330a69700aaf3ff6054b07265df","Clupea pallasii",21,"Clupea pallasii, Ethmidium maculatum","2, 3, 1, 11","30724",30724,"Eukaryota","Chordata","Actinopteri","Clupeiformes","Clupeidae","Clupea","Clupea pallasii","gi|1848856272|dbj|LC552350.1|, gi|985564913|dbj|LC020932.1|, gi|148922558|ref|NC_009578.1|, gi|985566912|dbj|LC091579.1|, gi|117671448|gb|DQ912047.1|",99.213,"CACCGCGGTTATACGAGAGGCCCTAGTTGATATACTCGGCGTAAAGAGTGGTTATGGAGAACAAGCACTAAAGCCAAAGAGCCCTCAGGCCGTTATACGCACCCGGGGCCTCGAACCACTATCACGAAAGTAGCTTTACCCTCGCCCACCAGAACCCACGAGA","2025-08-12"
"80","456c9fd0798e7037a563bb5ab9fac5c6b581a2d2","Gadus",3,"Gadus chalcogrammus, Gadus macrocephalus, Gadus finnmarchicus, Boreogadus saida, Gadus ogac","0, 1, 2","1042646 80720",8048,"Eukaryota","Chordata","Actinopteri","Gadiformes","Gadidae","Gadus","","gi|1783586359|gb|MH035595.1|, gi|1783586345|gb|MH035594.1|, gi|1347724927|ref|NC_036931.1|, gi|1096114933|dbj|AP017650.1|, gi|985567160|dbj|LC091827.1|, gi|821091570|gb|KP644356.1|, gi|2222646889|gb|OM174271.1|",99.39,"CACCGCGGTTATACGAGAGGCCCAAATTGATGAAAAACGGCGTAAAGCGTGGTTAAGAAAAAGAGAAAATATGGCCGAACAGCTTCAAAGCAGTTATACGCATCCGAAGTCACGAAGAACAATCACGAAAGTTGCCCTAAAACCTCCGATTCCACGAAAGCCA","2025-08-12"
"81","46c64fd987adb055fcc1c4edb7f1682d1278c85a","Lepidopsetta",1,"Lepidopsetta polyxystra, Lepidopsetta bilineata, Lepidopsetta mochigarei, Parophrys vetulus, Isopsetta isolepis, Psettichthys melanostictus, Platichthys stellatus, Myzopsetta ferruginea, Platichthys flesus, Liopsetta glacialis, Platichthys stellatus x Verasper variegatus, Platichthys stellatus x (Kareius bicoloratus x Platichthys stellatus), Kareius bicoloratus x Platichthys stellatus, Platichthys stellatus;Liopsetta pinnifasciata;Platichthys stellatus x Parophrys vetulus, Glyptocephalus stelleri, Glyptocephalus zachirus;Glyptocephalus stelleri, Kareius bicoloratus, Limanda aspera, Hippoglossoides elassodon;Acanthopsetta nadeshnyi;Hippoglossoides robustus, Pseudopleuronectes americanus, Hippoglossoides platessoides","0, 1, 2, 3","433389 195623 255558",195622,"Eukaryota","Chordata","Actinopteri","Pleuronectiformes","Pleuronectidae","Lepidopsetta","","gi|2587926887|ref|NC_082812.1|, gi|985566080|dbj|LC049658.1|, gi|985566062|dbj|LC049640.1|, gi|985566061|dbj|LC049639.1|, gi|985563408|dbj|LC092091.1|, gi|22532239|gb|AF488479.1|",100,"CACCGCGGTTATACGAGAGGCCCAAGTTGACAAACAACGGCGTAAAGAGTGGTTAGGGGATTAAATAAACTAGAGCCGAACGCTTTCAAAGCTGTTATACGCACCCGAAAGTATGAAACCCAATTACGAAAGTAGCTCTACCTATCCTGAACCCACGAAAGCT","2025-08-12"
"82","48e1ee19e356e6834755d848add8e654071d4463","Liparis",3,"Liparis miostomus, Liparis tanakae, Liparis tessellatus, Liparis gibbus, Liparis ochotensis, Liparis fabricii, Liparis inquilinus, Liparis bathyarcticus, Liparis agassizii, Liparis mucosus, Rhinoliparis barbulifer, Rhinoliparis attenuatus, Liparis fucensis, Liparis dennyi, Polypera greeni, Liparis cyclopus, Careproctus sp. OCF-P20080722-1, Elassodiscus caudatus, Nectoliparis pelagicus, Liparis pulchellus, Paraliparis rosaceus, Lipariscus nanus, Elassodiscus tremebundus, Squaloliparis dentatus, Careproctus cyclocephalus, Liparis florae","5, 8, 9, 10, 11, 12, 13, 14","2057043",2057043,"Eukaryota","Chordata","Actinopteri","Perciformes","Liparidae","Liparis","","gi|2005592611|dbj|LC340110.2|",96.296,"TACCGCGGTTATACGAGAGGCTCAAGTTGAAAGACACCGGCGTAAAGCGTGGTTAAGTTAAAATTTAAGCTAAAGTTAAACACCTTCAAGACTGTTATACGTACCCGAAGAAAGGAACCTCAATTACGAAAGTAACTTTACACAAGCTGAATCCACGAAAGCT","2025-08-12"
