"","Hash","BestTaxon","HaplotypeNumber","Tax_list","Mismatches","BlastTaxIDs","LCA_taxid","Kingdom","Phylum","Class","Order","Family","Genus","Species","AccessionNumbers","Max_pident","Sequence","DateAdded"
"200","c18971e5fa449729ed8b7bef982554672e42a8cb","Icelinus borealis",1,"Icelinus borealis, Icelinus burchami, Icelinus filamentosus, Alcichthys elongatus, Icelinus pietschi, Icelinus fimbriatus, Bero elegans, Artediellus sp. HUMZ:166735, Stlengis misakia, Ascelichthys rhodorus, Artediellus neyelovi, Cottiusculus schmidti, Radulinus boleoides, Cottiusculus nihonkaiensis, Artediellus pacificus, Artediellus scaber, Artediellus dydymovi, Triglops scepticus, Cottus asper, Scorpaenichthys marmoratus, Radulinus asprellus, Artediellus uncinatus, Phasmatocottus ctenopterygius, Microcottus sellaris, Psychrolutes phrictus, Cottocomephorus grewingki, Paracottus knerii, Leocottus kesslerii, Cottus gobio, N/A","0, 7, 6, 8, 9, 10, 11, 12","433388",433388,"Eukaryota","Chordata","Actinopteri","Perciformes","Cottidae","Icelinus","Icelinus borealis","gi|2587926929|ref|NC_082815.1|, gi|985563249|dbj|LC091932.1|",100,"CACCGCGGTTATACGAGAGGCCCAAGTTGACAAACACCGGCGTAAAGCGTGGTTAAGCTAAAACTCATACTAAAGCCAAACACCTTCAAAGCTGTTATACGCACCCGAAGGCAGGAAGTTCAACCACGAAAGTGGCTTTAATTCGATCTGAGTCCACGAAAGC","2025-08-12"
"201","c3bf981786a5db5cb3d8c32c4e6f8c961cd07d9c","Oncorhynchus keta",5,"Oncorhynchus keta, Oncorhynchus nerka, Oncorhynchus kisutch, Oncorhynchus keta;Oncorhynchus nerka, Oncorhynchus kawamurae, Oncorhynchus mykiss, Oncorhynchus mykiss gairdneri, Oncorhynchus clarkii lewisi, Oncorhynchus mykiss irideus, Oncorhynchus mykiss newberrii, Oncorhynchus gilae apache, Oncorhynchus gilae, Oncorhynchus gorbuscha, N/A","3, 4, 5, 6","8018",8018,"Eukaryota","Chordata","Actinopteri","Salmoniformes","Salmonidae","Oncorhynchus","Oncorhynchus keta","gi|985566566|dbj|LC069501.1|, gi|2305126365|gb|OL339394.1|, gi|2305126350|gb|OL339393.1|, gi|385843132|ref|NC_017838.1|, gi|2778079950|gb|PQ083393.1|",98.16,"CACCGCGGTTATACGAGAGGCCCTAGTTGATAACTACCGGCGTAAAGAGTGGTTATGGAAAATATTTAATAAAGCCGAACACCCCCTCAGCCGTCATACGCACCGGGAAGCACCAAGACCTACCGCGAAAGCAGCTTTAATTATGCCTGACCCCACGACAGCT","2025-08-12"
"202","c430f0c591873f378940f00540a0f53563377073","Oncorhynchus",4,"Oncorhynchus mykiss, Oncorhynchus mykiss nelsoni, Oncorhynchus chrysogaster, Oncorhynchus gilae, Oncorhynchus mykiss gairdneri, Oncorhynchus clarkii lewisi, Oncorhynchus mykiss irideus, Oncorhynchus mykiss newberrii, Oncorhynchus gilae apache, Oncorhynchus nerka, Oncorhynchus clarkii henshawi, Oncorhynchus mykiss x Salmo salar, Oncorhynchus kawamurae","0, 1","8022 3030642 648071 64185 857570 490388 857569 2978582 209197",8016,"Eukaryota","Chordata","Actinopteri","Salmoniformes","Salmonidae","Oncorhynchus","","gi|2812967822|gb|PQ284210.1|, gi|2812967808|gb|PQ284209.1|, gi|2812967724|gb|PQ284203.1|, gi|1352192337|gb|KY798500.1|, gi|1276392030|gb|MF621750.1|, gi|2714808899|gb|PP620833.1|, gi|2449539989|gb|OP902891.1|, gi|2715299418|ref|NC_087622.1|, gi|770591431|gb|KP013084.1|, gi|2445527499|gb|OQ301638.1|, gi|2675382884|dbj|LC799144.1|, gi|815248813|dbj|LC050735.1|, gi|2305126263|gb|OK637252.1|, gi|2305126232|gb|OK637248.1|, gi|2305126187|gb|OK623665.1|, gi|2305126172|gb|OK623662.1|, gi|2305126143|gb|OK583899.1|, gi|2305126099|gb|OK040162.1|, gi|2305125701|gb|OK623679.1|, gi|2067616704|gb|MZ567214.1|, gi|1953426706|gb|MW300342.1|, gi|1953426622|gb|MW300336.1|, gi|1953426608|gb|MW300335.1|, gi|2088241430|ref|NC_056957.1|, gi|1935001868|gb|MT667254.1|, gi|1896498849|gb|MT410879.1|, gi|82492328|gb|DQ288271.1|, gi|82492314|gb|DQ288270.1|, gi|82492300|gb|DQ288269.1|",100,"CACCGCGGTTATACGAGAGGCCCTAGTTGATAACTACCGGCGTAAAGAGTGGTTATGGAAAAATATTTAATAAAGCCGAACACCCCCTCAGCCGTCATACGCACCTGGGAGCACGAAGACCTACTGCGAAAGCAGCTTTAACTATGCCTGACCCCACGACAGC","2025-08-12"
"203","c4cf5a5291befadd9efbf117514df59ced1c55df","Clupea pallasii",51,"Clupea pallasii","2, 3, 1","30724",30724,"Eukaryota","Chordata","Actinopteri","Clupeiformes","Clupeidae","Clupea","Clupea pallasii","gi|1848856272|dbj|LC552350.1|, gi|985564913|dbj|LC020932.1|, gi|148922558|ref|NC_009578.1|, gi|985566912|dbj|LC091579.1|, gi|117671448|gb|DQ912047.1|",99.213,"CACCGCGGTTATACGAGAGGCCCTAGTTGATATACTCGGCGTAAAGAGTGGTTATGGAAAACAAGCACTAAAGCCAAAGAGCCCTCAGGCCGTTATACGCACCCGGGGCCTCGAACCACTACCACGAAAGTAGCTTTACCCTCGCCCACCAGAACCCACGAGA","2025-08-12"
"204","c54aa63827e29468d7265f50710c50c40666c791","Clupea pallasii",52,"Clupea pallasii, Sprattus muelleri, Sprattus antipodum, Ethmidium maculatum","1, 2, 11, 12, 13","30724",30724,"Eukaryota","Chordata","Actinopteri","Clupeiformes","Clupeidae","Clupea","Clupea pallasii","gi|985566912|dbj|LC091579.1|",99.387,"CACCGCGGTTATACGAGAGACCCTAGTTGATATACTCGGCGTAAAGAGTTGTTATGGAAAACAAGCACTAGAGCCAAAGAGCCCTCAGGCCGTTATACGCACCCGGGGCCTCGAACCACTATCACGAAAGTAGCTTTACCCTCGCCCACCAGAACCCACGAGA","2025-08-12"
"205","c860dc05e06c892e672b3e3b6bcef7a01715c40d","Hypomesus",4,"Hypomesus pretiosus, Hypomesus transpacificus, Spirinchus thaleichthys, Thaleichthys pacificus, Allosmerus elongatus, Osmerus mordax, Osmerus mordax dentex, Hypomesus olidus, Spirinchus starksi, Hypomesus nipponensis, Plecoglossus altivelis ryukyuensis, Plecoglossus altivelis altivelis, Plecoglossus altivelis, Mallotus villosus, Neosalangichthys ishikawae, Salanx cuvieri","1, 2, 5, 6, 7, 8, 9, 4, 10, 11, 12","300346 137520",137519,"Eukaryota","Chordata","Actinopteri","Osmeriformes","Osmeridae","Hypomesus","","gi|985566938|dbj|LC091605.1|, gi|2459373154|ref|NC_072210.1|, gi|2314981644|ref|NC_066905.1|",99.387,"CACCGCGGTAATACGAGTGGCCCAAGTTGAAAGTTACCGGCGTAAAGAGTGGTTAGGGAAACAATAAACTAAAGCCGAACACCCTCTAGGCTGTTATACGCTTCTGAGGGCACGAAGCCCCACTACGAAAGTGGCTTTAATTCACCTGAACCCACGACAGCTA","2025-08-12"
"206","c906219c3f56ce0d0f98d551c25192c5affccb45","Clupea pallasii",53,"Clupea pallasii, Sprattus muelleri, Sprattus antipodum, Ethmidium maculatum","1, 2, 8, 9, 10","30724",30724,"Eukaryota","Chordata","Actinopteri","Clupeiformes","Clupeidae","Clupea","Clupea pallasii","gi|1848856272|dbj|LC552350.1|, gi|985564913|dbj|LC020932.1|, gi|148922558|ref|NC_009578.1|",99.387,"CACCGCGGTTATACGAGAGACCCTAGTTGATATACTCGGCGTAAAGAGTGGTTATGGAAAACAAGCACTAAAGCCAAAGAGCCCTCAGGCCGTTATACGCACCCGGGGCCTCGAACCACTATCACGAAAGTAGCTTTACCCTCGCCCACCAGAATCCACGAGA","2025-08-12"
"207","c9211f7cbd347de8ddabaa4b519bb102c78dda70","Clupea pallasii",54,"Clupea pallasii","2, 3, 0","30724",30724,"Eukaryota","Chordata","Actinopteri","Clupeiformes","Clupeidae","Clupea","Clupea pallasii","gi|117671448|gb|DQ912047.1|",100,"CACCGCGGTTATACGAGAGGCCCTAGTCGATATACTCGGCGTAAAGAGTGGTTATGGAAAACAAGCACTAAAGCCAAAGAGCCCTCAGGCCGTTATACGCACCCGGGGCCTCGAACCACTATCACGAAAGTAGCTTTACCCTCGCCCACCAGAACCCACGAGA","2025-08-12"
"208","ca705330b2e97b027f1994192959b83259f9d938","Lycodopsis pacificus",2,"Lycodopsis pacificus, Lycodes cortezianus, Lycodes diapterus beringi, Lycodes raridens, Lycodes terraenovae, Lycodes esmarkii, Lycodes adolfi, Lycodes nakamurae, Lycodes vahlii, Bothrocarina nigrocaudata, Lycodes pectoralis, Lycodes polaris, Lycodes palearis, Lycodes fasciatus, Lycodes japonicus, Lycodes lavalaei, Lycodes brevipes, Lycodes reticulatus, Lycodes tanakae, Lycodes turneri, N/A, Lycodes tanakae;N/A, Lycodes sp. ADK-2014, Lycodes soldatovi, Lycodes rossi, Lycenchelys squamosa, Lycodes ocellatus, Bothrocara zestum, Bothrocara hollandi","1, 5, 6, 7, 8, 9, 10, 11","1772091",1772091,"Eukaryota","Chordata","Actinopteri","Perciformes","Zoarcidae","Lycodopsis","Lycodopsis pacificus","gi|985563770|dbj|LC104685.1|, gi|985563761|dbj|LC104676.1|",99.387,"CACCGCGGTTATACGAGAGGCCCAAGTTGAAAGACCCCGGCGTAAAGAGTGGTTAAGCTAGTTTTTATATTAAAGCCGAACACCCTCACGGCTGTTATACGCACCCGAAGATAAGAAGCTCAACCACGAAGGTGGCTTTATATGCCCGAACCCACGAAAGCTA","2025-08-12"
"209","ccacfcc729d75d40e40c7c6c0e23471a2f6a4eb6","Clupea pallasii",55,"Clupea pallasii","2, 3, 1","30724",30724,"Eukaryota","Chordata","Actinopteri","Clupeiformes","Clupeidae","Clupea","Clupea pallasii","gi|1848856272|dbj|LC552350.1|, gi|985564913|dbj|LC020932.1|, gi|148922558|ref|NC_009578.1|, gi|985566912|dbj|LC091579.1|, gi|117671448|gb|DQ912047.1|",99.213,"CACCGCGGTTATACGAGAGGCCCTAGTTGATATACTCGGCGTAAAGAGTGGTTATGGAAAACAAGCACTAAAGCCAAAGAGCCCTCAGGCCGTTATACGCACCCGGGGCCTCGAACCCCTATCACGAAAGTAGCTTTACCCTCGCCCACCAGAACCCACGAGA","2025-08-12"
"210","cd60342e634c7fbc5149c15797ca73fde73ed136","Clupea pallasii",56,"Clupea pallasii, Sprattus muelleri, Sprattus antipodum, Ethmidium maculatum","2, 3, 11, 12, 13","30724",30724,"Eukaryota","Chordata","Actinopteri","Clupeiformes","Clupeidae","Clupea","Clupea pallasii","gi|1848856272|dbj|LC552350.1|, gi|985564913|dbj|LC020932.1|, gi|148922558|ref|NC_009578.1|, gi|985566912|dbj|LC091579.1|, gi|117671448|gb|DQ912047.1|",98.773,"CACCGCGGTTATACGAGAGACCCTAGTTGATATACTCGGCGTAAAGAGTGGTTATGGAAAACAAGCACTAAAGCCAAAGAGCCCTCAGGCCGTTATACGCACCCGGGGCCTCGAGCCACTATCACGAAAGTAGCTTTACCCTCGCCCGCCAGAACCCACGAGA","2025-08-12"
"211","cdb6b4da5da852188160dca1b19f4c7e7d2c5f78","Pleuronectidae",4,"Parophrys vetulus, Isopsetta isolepis, Psettichthys melanostictus, Platichthys stellatus, Myzopsetta ferruginea, Platichthys flesus, Lepidopsetta polyxystra, Liopsetta glacialis, Platichthys stellatus x Verasper variegatus, Lepidopsetta bilineata, Lepidopsetta mochigarei, Platichthys stellatus x (Kareius bicoloratus x Platichthys stellatus), Kareius bicoloratus x Platichthys stellatus, Platichthys stellatus;Liopsetta pinnifasciata;Platichthys stellatus x Parophrys vetulus, Pleuronectes quadrituberculatus, Limanda aspera, Glyptocephalus zachirus, Glyptocephalus stelleri, Glyptocephalus zachirus;Glyptocephalus stelleri, Kareius bicoloratus, Hippoglossoides elassodon;Acanthopsetta nadeshnyi;Hippoglossoides robustus, Pseudopleuronectes americanus, Hippoglossoides platessoides","0, 1, 2","172659 195617 195639",8256,"Eukaryota","Chordata","Actinopteri","Pleuronectiformes","Pleuronectidae","","","gi|2373975304|gb|OP035309.1|, gi|2571476604|gb|OR499737.1|, gi|2569353389|gb|OR482580.1|, gi|2587926803|ref|NC_082806.1|, gi|1018242347|dbj|LC145941.1|, gi|1018242344|dbj|LC145938.1|, gi|1018242343|dbj|LC145937.1|, gi|1018242342|dbj|LC145936.1|, gi|1018242331|dbj|LC145925.1|, gi|1018242330|dbj|LC145924.1|, gi|1018241275|dbj|LC145950.1|, gi|2314981994|ref|NC_066930.1|, gi|22532245|gb|AF488485.1|, gi|22532241|gb|AF488481.1|",100,"CACCGCGGTTATACGAGAGGCCCAAGTTGACAAACAACGGCGTAAAGAGTGGTTAGGGGATTTAATAAACTAGAGCCGAACGCTTTCAAAGCTGTTATACGCACCCGAAAGTATGAAACCCAATTACGAAAGTAGCTCTACCTATCCTGAACCCACGAAAGCT","2025-08-12"
"212","cf857fe542c376c4fa27b54c8173f28cc6828d77","Oligocottus",4,"Oligocottus maculosus;Oligocottus snyderi","1","328410 459052",328409,"Eukaryota","Chordata","Actinopteri","Perciformes","Cottidae","Oligocottus","","gi|985563225|dbj|LC091908.1|",99.387,"CACCGCGGTTATACGAGAGGCCCAAGTTGACAGATGCCGGCGTAAAACGTGGCTAGACTGAACCCCAACTAAAGCCAAACACCTTCAAAGCTGTGATACGCAAACGAAGGCAGGAGATACTACCACGAAAGTGGCTTTATCCAATTTGAACCCACGAAAGCTA","2025-08-12"
"213","cfed11eb73e53b0370814df86b9b34de8d528a93","Gadus",5,"Gadus chalcogrammus, Gadus finnmarchicus, Gadus macrocephalus, Gadus ogac","1, 2, 3","1042646 3083464",8048,"Eukaryota","Chordata","Actinopteri","Gadiformes","Gadidae","Gadus","","gi|1783586485|gb|MH035604.1|, gi|1783586457|gb|MH035602.1|, gi|1783586429|gb|MH035600.1|, gi|1783586415|gb|MH035599.1|, gi|1783586387|gb|MH035597.1|, gi|1783586373|gb|MH035596.1|, gi|1783586331|gb|MH035593.1|, gi|1783586317|gb|MH035592.1|, gi|1783586303|gb|MH035591.1|, gi|1783586289|gb|MH035590.1|, gi|1783586275|gb|MH035589.1|, gi|1783586261|gb|MH035588.1|, gi|1783586247|gb|MH035587.1|, gi|1783586205|gb|MH035584.1|, gi|1783586191|gb|MH035583.1|, gi|985565183|dbj|LC021202.1|, gi|2186980144|gb|MW288643.1|, gi|2186980116|gb|MW288641.1|, gi|124377093|emb|AM489719.1|, gi|124377079|emb|AM489718.1|, gi|49658522|dbj|AB182308.1|, gi|49658494|dbj|AB182306.1|, gi|49658452|dbj|AB182303.1|, gi|49658438|dbj|AB182302.1|, gi|49658410|dbj|AB182300.1|, gi|27228478|ref|NC_004449.1|",99.387,"CACCGCGGTTATACGAGAGGCCCAAATTGATGAAAAACGGCGTAAAGCGTGGTTAAGAAAAAAAGAGAAAATATGGCCAAACAGCTTCAAAGCAGTTATACGCATCCGAAGTCACGAAGAACAATCACGAAAGTTGCCCTAAAACCTCCGATTCCACGAAAGC","2025-08-12"
"214","d0c6e51f519bb372ef4ccb59ff46388f6f0bd2de","Anoplarchus",7,"Anoplarchus purpurescens, Anoplarchus purpurescens;Anoplarchus insignis, Leptoclinus maculatus, Anisarchus medius, Alectrias alectrolophus, Alectrias benjamini, Anisarchus macrops, Eumesogrammus praecisus, Opisthocentrus ocellatus, Ulvaria subbifurcata, Stichaeus punctatus, Xiphister atropurpureus, Zaprora silenus, Chirolophis japonicus, Askoldia variegata, Xiphister mucosus, Poroclinus rothrocki, Chirolophis wui, Ernogrammus hexagrammus, Chirolophis saitonis, Bryozoichthys lysimus, Chirolophis decoratus;Chirolophis nugator, Lumpenella longirostris, Xenolumpenus longipterus, Stichaeopsis nevelskoi, Pholidapus dybowskii, Chirolophis ascanii","1, 5, 6, 7","320623 320623 1225888",320622,"Eukaryota","Chordata","Actinopteri","Perciformes","Stichaeidae","Anoplarchus","","gi|985566742|dbj|LC069677.1|, gi|985563312|dbj|LC091995.1|",99.387,"CACCGCGGTTATACGAGAGGCCCAAGTTGACAGACATCGGCGTAAAGAGTGGTTAAGTTAAAATTCACACTAAAGCCGAACGTCCTCCAGGCTGTTATACGCACCCGAAGATAAGAAGTTCAATCACGAAAGTGGCTTTATTTAGTCTGAACCCACGAAAGCT","2025-08-12"
"215","d100fd1dfcfa6ff439c6bbc14d47bed7b1cdba90","Psychrolutes paradoxus",1,"Psychrolutes paradoxus, Psychrolutes sigalutes, Gilbertidia pustulosa, Psychrolutes phrictus, Cottunculus microps, Psychrolutes sp. MM-2017, Ebinania vermiculata, Zesticelus bathybius, Cottunculus thomsonii, Icelus mororanis, Zesticelus ochotensis, Malacocottus zonurus, Malacocottus gibber, Triglops scepticus, Icelus sekii, Astrocottus regulus, Malacocottus kincaidi, Malacocottus kincaidi;Malacocottus gibber;Malacocottus sp. HUMZ:215076;Malacocottus sp. HUMZ:222544, Psychrolutes macrocephalus, Radulinus boleoides, Ricuzenius pinetorum, Eurymen gyrinus, Triglops pingelii, Icelus spiniger, Artediellus sp. HUMZ:166735, Artediellus pacificus, Artediellus scaber, Cottus gulosus, Rastrinus scutiger, Leptocottus armatus, Batrachocottus baicalensis, Myoxocephalus quadricornis, Taurocottus bergii, Gymnocanthus galeatus, Myoxocephalus scorpius","0, 1, 4, 5, 6, 7, 8, 9","980342",980342,"Eukaryota","Chordata","Actinopteri","Perciformes","Psychrolutidae","Psychrolutes","Psychrolutes paradoxus","gi|985563645|dbj|LC104560.1|",100,"CACCGCGGTTATACGAGAGGCCCAAGTTGACAAACACCGGCGTAAAGCGTGGTTAAGTTAAACTCCTACTAAAGCCGAACATCTTCAAGGCTGTTATACGCAACCGAAGACAAGAAGTTCAACCACGAAGGTGGCTTTATCTGCTCTGAACCCACGAAAGCTA","2025-08-12"
"216","d1845e0ec88615bf3458d44825c69ff27e2b1492","Pholis",9,"Pholis gunnellus, Pholis laeta, Pholis ornata, Pholis crassispina;Pholis picta;Pholis clemensi, Pholis crassispina, Pholis picta, Pholis nebulosa, Eumesogrammus praecisus, Opisthocentrus ocellatus, Pholidapus dybowskii, Pholis fangi, Ulvaria subbifurcata, Askoldia variegata, Rhodymenichthys dolichogaster, Lumpenella longirostris, Alectrias benjamini, Dictyosoma burgeri","1, 2, 3, 5, 6","56726 283367",56725,"Eukaryota","Chordata","Actinopteri","Perciformes","Pholidae","Pholis","","gi|1515576542|gb|MH377827.1|, gi|985563337|dbj|LC092020.1|",99.387,"CACCGCGGTTATACGAGAGGCCCAAGTTGAGAGACATCGGCGTAAAGAGTGGTTAAGTTAAAATTGTACTAAAGCCGAACATCCTCCAGGCTGTTATACGCATCCGAAGATAAGAAGTTCAACCACGAAGGTAGCTTTATTTAGTCTGAACCCACGAAAGCTA","2025-08-12"
"217","d1b5c6ba2427d9685e0e160f85dd4b64ed363f88","Liparis",4,"Liparis fucensis, Liparis dennyi, Liparis gibbus, Liparis ochotensis, Liparis bathyarcticus, Liparis agassizii, Liparis fabricii, Liparis inquilinus, Rhodichthys regina, Careproctus cyclocephalus, Careproctus sp. OCF-P20080722-1, Liparis tessellatus, Liparis miostomus, Paraliparis sp. NSMT P92399, Rhinoliparis barbulifer, Rhinoliparis attenuatus, Liparis cyclopus, Liparis tanakae, Paraliparis meridionalis, Paraliparis copei, Nectoliparis pelagicus, Liparis mucosus, Paraliparis dipterus, Paraliparis rosaceus, Lipariscus nanus, Elassodiscus caudatus, Psednos melanocephalus, Liparis florae","1, 4, 5, 6, 7, 10, 9, 11, 12, 13, 14","433401 433403",183716,"Eukaryota","Chordata","Actinopteri","Perciformes","Liparidae","Liparis","","gi|985563671|dbj|LC104586.1|, gi|985563670|dbj|LC104585.1|, gi|985563665|dbj|LC104580.1|",99.387,"CACCGCGGTTATACGAGAGGCCCAAGTTGAAAGACACCGGCGTAAAGCGTGGTTAAACTAAGATTTAAATTAAAGTTAAACATCTTCAAGGCTGTTATACGCACCCGAAGACAGGAACCTCAATTACGAAAGTAACTTTATACAAGCTGAACCCACGAAAGCT","2025-08-12"
"218","d22a0bec59dd88b61b90b741d2d094a4cab96539","Anoplarchus",8,"Anoplarchus purpurescens, Anoplarchus purpurescens;Anoplarchus insignis, Leptoclinus maculatus, Anisarchus medius, Alectrias alectrolophus, Ernogrammus hexagrammus, Alectrias benjamini, Anisarchus macrops, Dictyosoma rubrimaculatum, Xiphister atropurpureus, Zaprora silenus, Cryptacanthodes maculatus, Andriashevia sp. CBM:ZF:16351-1;Andriashevia sp. CBM:ZF:16351-2, Chirolophis japonicus, Opisthocentrus tenuis, Stichaeus punctatus, Stichaeopsis nana, Pseudalectrias tarasovi, Askoldia variegata, Opisthocentrus ocellatus, Cryptacanthodes giganteus, Xiphister mucosus, Poroclinus rothrocki, Chirolophis wui, Kasatkia memorabilis, Eumesogrammus praecisus","1, 7, 8","320623 320623 1225888",320622,"Eukaryota","Chordata","Actinopteri","Perciformes","Stichaeidae","Anoplarchus","","gi|985566742|dbj|LC069677.1|, gi|985563312|dbj|LC091995.1|",99.387,"CACCGCGGTTATACGAGAGGCCCAAGTTGATAGACATCGGCGTAAAGAGTGGTTAAGTTAAAATTCACACTAAAGCCGAACGTCCTCCAGGCTGTTATACGCACCCGAAGATAAGAAGTTCAATCACGAAAGTGGCTTTATTTAATCTGAACCCACGAAAGCT","2025-08-12"
"219","d2440d5dc2d5b100dd53a7253b80742d87c4309d","Sebastes",3,"Sebastes dallii, Sebastes auriculatus, Sebastes saxicola, Sebastes maliger, Sebastes entomelas, Sebastes caurinus, Sebastes mystinus, Sebastes nebulosus, Sebastes iracundus;Sebastes semicinctus, Sebastes ventricosus, Sebastes oculatus, Sebastes wakiyai, Sebastes baramenuke, Sebastes ruberrimus","0, 1, 2","394690 72057",34820,"Eukaryota","Chordata","Actinopteri","Perciformes","Sebastidae","Sebastes","","gi|2373974725|gb|OP035142.1|, gi|2587926326|ref|NC_082772.1|, gi|985563586|dbj|LC104501.1|, gi|985563579|dbj|LC104494.1|, gi|985563578|dbj|LC104493.1|",100,"CACCGCGGCTATACGAGAGACCCAAGTTGATACCATTCGGCGTAAAGAGTGGTTATGGAAAATAAAGACTAAAGCCGCACACCTTCAAAGCTGTTATACGCATCCGAAGGTTAGAAGACCAACCACGAAGGTAGCTTTACAACCCCTGACCCCACGAAAGCTC","2025-08-12"
"220","d2937658c2c16c679a06c9c6117eafcae0ca267f","Myoxocephalus",1,"Myoxocephalus jaok, Myoxocephalus polyacanthocephalus;Myoxocephalus stelleri, Myoxocephalus stelleri, Myoxocephalus polyacanthocephalus, Myoxocephalus scorpius, Myoxocephalus quadricornis, Myoxocephalus polyacanthocephalus;Myoxocephalus jaok, Myoxocephalus brandtii, Microcottus sellaris, Myoxocephalus aenaeus, Megalocottus platycephalus, Argyrocottus zanderi, Myoxocephalus octodecemspinosus, Enophrys diceraus, Gymnocanthus tricuspis, Radulinus asprellus, Radulinus boleoides, Eurymen gyrinus, Triglops scepticus, Leptocottus armatus, Cottunculus thomsonii, Porocottus allisi, Taurocottus bergii","0, 1, 2, 3, 4, 5, 7, 8","980339 238839 239743 239743 238839",8095,"Eukaryota","Chordata","Actinopteri","Perciformes","Cottidae","Myoxocephalus","","gi|1808706708|gb|MN162695.1|, gi|1812092823|ref|NC_045875.1|, gi|985563254|dbj|LC091937.1|, gi|2264236692|dbj|LC717523.1|, gi|2183321079|dbj|LC672510.1|, gi|669175227|gb|KM057974.1|",100,"CACCGCGGTTATACGAGAGGCCCAAGTTGACAAACACCGGCGTAAAGCGTGGTTAAGTAAAAACTTACACTAAAGCCAAACATCTTCCAGGCTGTTATACGCAACCGAAGACAGGAAGTTCAACCACGAAAGTGGCTTTATCTAGTCTGAACCCACGAAAGCT","2025-08-12"
"221","d2d739fba0b90da6bbbf745ee715be70c7bbd144","Icelinus borealis",2,"Icelinus borealis, Icelinus burchami, Icelinus filamentosus, Alcichthys elongatus, Icelinus pietschi, Icelinus fimbriatus, Bero elegans, Artediellus sp. HUMZ:166735, Stlengis misakia, Ascelichthys rhodorus, Artediellus neyelovi, Cottiusculus schmidti, Radulinus boleoides, Cottiusculus nihonkaiensis, Artediellus pacificus, Artediellus scaber, Artediellus dydymovi, Triglops scepticus, Cottus asper, Scorpaenichthys marmoratus, Radulinus asprellus, Artediellus uncinatus, Phasmatocottus ctenopterygius, Microcottus sellaris, Psychrolutes phrictus, Cottocomephorus grewingki, Paracottus knerii, Leocottus kesslerii, Cottus gobio, N/A","1, 8, 7, 9, 10, 11, 12, 13","433388",433388,"Eukaryota","Chordata","Actinopteri","Perciformes","Cottidae","Icelinus","Icelinus borealis","gi|2587926929|ref|NC_082815.1|, gi|985563249|dbj|LC091932.1|",99.387,"CACCGCGGTTATACGAGAGGCCCAAGTTGACAAACACCGGCGTAAAGCGTGGTTAAGCTAAAACTCATACTAAAGCCAAACACCTTTAAAGCTGTTATACGCACCCGAAGGCAGGAAGTTCAACCACGAAAGTGGCTTTAATTCGATCTGAGTCCACGAAAGC","2025-08-12"
"222","d2e64a4f17c24b34f99ae5361a721d735dc005c1","Odontopyxis trispinosa",2,"Odontopyxis trispinosa, Agonopsis vulsa, Bathyagonus infraspinatus, Bathyagonus alascanus, Xeneretmus latifrons, Bathyagonus nigripinnis, Xeneretmus leiops, Xeneretmus latifrons;Bathyagonus nigripinnis, Bathyagonus pentacanthus, Occella dodecaedron, Tilesina gibbosa;Occella dodecaedron, Chesnonia verrucosa, Chesnonia verrucosa;Pallasina barbata;Brachyopsis segaliensis, Brachyopsis segaliensis, Blepsias cirrhosus, Occella iburia, Blepsias bilobus, Stellerina xyosterna, Podothecus accipenserinus, Percis japonica, Hemilepidotus gilberti, Leptagonus decagonus, Podothecus sachi, Podothecus veternus, Sarritor frenatus, Podothecus sachi;Podothecus sturioides, Hemitripterus bolini, Hypsagonus jordani, Hemilepidotus zapus, Sarritor leptorhynchus, Hemitripterus villosus, Hemitripterus americanus, Hemilepidotus jordani","0, 1, 2, 3, 4, 6, 7, 8, 9, 10, 11","320620",320620,"Eukaryota","Chordata","Actinopteri","Perciformes","Agonidae","Odontopyxis","Odontopyxis trispinosa","gi|2580315337|gb|OR582693.1|",100,"CACCGCGGTTATACGAGAGACCCAAGTTGATAGCCACCGGCGTAAAGCGTGGTTAAGTTAAAACTCATACTAAAGTTAAACATCTTCAAGACTGTTATACGTAACCGAAGATAGGAAGTCCAACCACGAAAGTGACTTTACTTGATCTGAACCCACGAAAGCT","2025-08-12"
"223","d37f6984c36ef54a5c9179b4827b4634d3edebad","Liparis",5,"Liparis fucensis, Liparis dennyi, Liparis gibbus, Liparis ochotensis, Liparis bathyarcticus, Liparis agassizii, Liparis fabricii, Liparis inquilinus, Liparis tanakae, Liparis cyclopus, Careproctus cyclocephalus, Liparis tessellatus, Rhinoliparis barbulifer, Rhinoliparis attenuatus, Liparis miostomus, Rhodichthys regina, Nectoliparis pelagicus, Careproctus sp. OCF-P20080722-1, Liparis mucosus, Paraliparis sp. NSMT P92399, Paraliparis rosaceus, Elassodiscus caudatus, Polypera greeni, Paraliparis copei, Liparis florae, Crystallichthys cyclospilus, Careproctus roseofuscus, Careproctus marginatus","3, 4, 5, 6, 7, 8, 9, 10, 11, 12, 13, 14, 15","433401 433403",183716,"Eukaryota","Chordata","Actinopteri","Perciformes","Liparidae","Liparis","","gi|985563671|dbj|LC104586.1|, gi|985563670|dbj|LC104585.1|, gi|985563665|dbj|LC104580.1|",98.16,"CACCGCGGTTATACGAGAGACCCAAGTTGAAAGACACCGGCGTAAAGCGTGGTTAAGCTAAAATTTAAATTAAAGTTAAACATCTTCAAGGCTGTTATACGCACCCGAAGACAGGAACCTCAACTACGAAAGTAACTTTATACAAGCTGAACCCACGAAAGCT","2025-08-12"
"224","d517a227c42da4a83fa69e6b2e51ef8933d7f9c5","Clupea pallasii",57,"Clupea pallasii, Sprattus muelleri, Sprattus antipodum, Ethmidium maculatum","1, 2, 10, 11, 0, 12","30724",30724,"Eukaryota","Chordata","Actinopteri","Clupeiformes","Clupeidae","Clupea","Clupea pallasii","gi|117671448|gb|DQ912047.1|",100,"CACCGCGGTTATACGAGAGACCCTAGTTGATATAATCGGCGTAAAGAGTGGTTATGGAAAACAAGCACTAAAGCCAAAGAGCCCTCAGGCCGTTATACGCACCCGGGGCCTCGAACCACTATCACGAAAGTAGCTTTACCCTCGCCCACCAGAACCCACGAGA","2025-08-12"
"225","d5700eeb9580ac97aa9183292265cdb2776a9ce1","Pholis laeta",6,"Pholis laeta, Pholis gunnellus, Pholis ornata, Pholis crassispina;Pholis picta;Pholis clemensi, Pholis crassispina, Pholis picta, Pholis nebulosa, Eumesogrammus praecisus, Opisthocentrus ocellatus, Pholidapus dybowskii, Ulvaria subbifurcata, Askoldia variegata, Xenolumpenus longipterus, Anisarchus medius, Cryptacanthodes maculatus, Poroclinus rothrocki, Lumpenella longirostris, Stichaeopsis nevelskoi, Anisarchus macrops, Opisthocentrus tenuis, Alectrias benjamini, Stichaeopsis nana, Dictyosoma burgeri, Pholis fangi","1, 2, 3, 4, 5, 6, 7","283367",283367,"Eukaryota","Chordata","Actinopteri","Perciformes","Pholidae","Pholis","Pholis laeta","gi|985563337|dbj|LC092020.1|",99.387,"CACCGCGGTTATACGAGAGGCCCAAGTTGAAAGACATCGGCGTAAAGAGTGGTTAAGTTAAAATTTTACTAAAGCCGAACATCCTCCAGGCTGTTATACGCATCCGAAGATAAGAAGTTCAACCACGAAGGTAGCTTTATTTAGTCTGAACCCACGAAAGCTA","2025-08-12"
"226","d645278d884922bf857c65f86cabd98384abaad9","Pholis ornata",4,"Pholis ornata, Pholis gunnellus, Pholis laeta, Pholis crassispina;Pholis picta;Pholis clemensi, Pholis crassispina, Pholis picta, Pholis nebulosa, Rhodymenichthys dolichogaster, Lumpenella longirostris, Pholis fangi, Ulvaria subbifurcata, Stichaeus punctatus, Eumesogrammus praecisus, Stichaeopsis epallax, Pholidapus dybowskii, Askoldia variegata, Opisthocentrus ocellatus, Alectrias benjamini, Dictyosoma burgeri","1, 2, 3, 4, 5, 6, 7","283028",283028,"Eukaryota","Chordata","Actinopteri","Perciformes","Pholidae","Pholis","Pholis ornata","gi|985563335|dbj|LC092018.1|, gi|2314982022|ref|NC_066932.1|",99.387,"CACCGCGGTTATACGAGAGGCCCAAGTTGACAGACATCGGCGTAAAGAGTGGTTAAGTTAAAACTGTACTAAAGCCGAACATCCTCCAGGCTGTTATACGCATCCGAAGATGAGAAGTTCAACCACGAAGGTAGCTTTATTTAGTCTGAACCCACGAAAGCTA","2025-08-12"
"227","d666e1dbd6803f0b6c03cd46ca13ef6fcbab57e2","Oligocottus",5,"Oligocottus maculosus;Oligocottus snyderi","0","328410 459052",328409,"Eukaryota","Chordata","Actinopteri","Perciformes","Cottidae","Oligocottus","","gi|985563225|dbj|LC091908.1|",100,"CACCGCGGTTATACGAGAGGCCCAAGTTGACAGATGCCGGCGTAAAACGTGGCTAGACTGAACCCCAACTAAAGCCAAACACCTTCAAAGCTGTGATACGCAAACGAAGGCAGGAAATACTACCACGAAAGTGGCTTTATCCAATTTGAACCCACGAAAGCTA","2025-08-12"
"228","d7461302fb860d80902442276ac3a91306cb5ceb","Artedius lateralis",3,"Artedius lateralis, Artedius harringtoni, Artedius fenestralis","1, 11, 14","322683",322683,"Eukaryota","Chordata","Actinopteri","Perciformes","Cottidae","Artedius","Artedius lateralis","gi|985563239|dbj|LC091922.1|",99.383,"CACCGCGGTTATACGAATGACCCAAGTTGACAGATACTCGGCGTAAAACGTGGCTAAGCTACACACTCCCACTAAAGCCAAACACCTTCAAAGCTGTGATACGCAATCGAAGGCAGGAAGTCCCACCACGAAAGTGGCTTTACCTAATCTGAGTCCACGAAAA","2025-08-12"
