"","Hash","BestTaxon","HaplotypeNumber","Tax_list","Mismatches","BlastTaxIDs","LCA_taxid","Kingdom","Phylum","Class","Order","Family","Genus","Species","AccessionNumbers","Max_pident","Sequence","DateAdded"
"1","0474c7f6118f227a0fb10a9da3325d0c8b04fee9","Leptocottus armatus",1,"Leptocottus armatus, N/A, Cottus czerskii, Taurocottus bergii, Cottus ricei, Cottus asper, Cottus beldingii, Cottus marginatus, Cottus perplexus, Cottus gulosus, Batrachocottus baicalensis, Cottocomephorus grewingki, Cottus gobio, Cottus bairdii, Triglops scepticus, Cottocomephorus inermis, Comephorus baikalensis, Batrachocottus talievi, Batrachocottus nikolskii, Batrachocottus multiradiatus, Mesocottus haitej, Procottus major, Cottus cognatus, Cottus hangiongensis, Cottus aleuticus, Cottus pollux","0, 1, 3, 2, 4","214925",214925,"Eukaryota","Chordata","Actinopteri","Perciformes","Cottidae","Leptocottus","Leptocottus armatus","gi|2580315490|gb|OR582704.1|, gi|985563247|dbj|LC091930.1|",100,"CACCGCGGTTATACGAGAGGCCCAAGTTGACAAACACCGGCGTAAAGCGTGGTTAAGTTAATAAATCACACTAAAGCCAAACATCTTCAAGACTGTTATACGTAACCGAAGACAGGAAGTTCAACCACGAAAGTGGCTTTATCTGATCTGAACCCACGAAAGC","2025-08-12"
"2","052e45621a684b3e0e30dbe5e47b69427f57a587","Apodichthys flavidus",1,"Apodichthys flavidus, Bryozoichthys lysimus, Chirolophis decoratus;Chirolophis nugator, Eumesogrammus praecisus, Opisthocentrus ocellatus, Pholidapus dybowskii, Xenolumpenus longipterus, Ulvaria subbifurcata, Askoldia variegata, Pholis crassispina, Anisarchus medius, Chirolophis japonicus, Poroclinus rothrocki, Lumpenella longirostris, Chirolophis wui, Stichaeopsis nevelskoi, Alectrias benjamini, Anisarchus macrops, Chirolophis ascanii, Pholis crassispina;Pholis picta;Pholis clemensi, Pholis picta, Kasatkia memorabilis, Stichaeus punctatus, Opisthocentrus zonope, Opisthocentrus tenuis, Stichaeopsis nana","2, 4, 5, 6, 7","57779",57779,"Eukaryota","Chordata","Actinopteri","Perciformes","Pholidae","Apodichthys","Apodichthys flavidus","gi|985563339|dbj|LC092022.1|, gi|2314982008|ref|NC_066931.1|",98.16,"CACCGCGGTTATACGAGAGGCCCAAGTTGACAGACATCGGCGTAAAGAGTGGTTAAGTTGAATTTGTACTAAAGCCGAACACCCTCAAGGCTGTTATACGCACCCGAAGATAAGAAGTTCAACCACGAAGGTGGCTTTGATCCAGTCTGAACCCACGAAAGCT","2025-08-12"
"3","06b4f7b9b1c124cbac8955eaa0e62599b62bee3e","Artedius harringtoni",1,"Artedius harringtoni, Artedius lateralis","0, 12","433399",433399,"Eukaryota","Chordata","Actinopteri","Perciformes","Cottidae","Artedius","Artedius harringtoni","gi|985563237|dbj|LC091920.1|",100,"CACCGCGGTTATACGAATGGCCCAAGTTGACAGATACTCGGCGTAAAACGTGGCTAAGTCATACACTCACACTAAAGCCAAACACCTTCAAGGCTGTCATACGCAACCGAAGGCAGGAAGTCCCTCCACGAAAGTGGCTTTACCTTATCTGAGCCCACGAAAG","2025-08-12"
"4","0829c16dc8b4d2e30d7c210607e9695cf8a4278a","Enophrys bison",1,"Enophrys bison, Myoxocephalus aenaeus, Myoxocephalus scorpius, Myoxocephalus quadricornis, Microcottus sellaris, Myoxocephalus octodecemspinosus, Myoxocephalus jaok, Myoxocephalus polyacanthocephalus;Myoxocephalus jaok, Myoxocephalus polyacanthocephalus;Myoxocephalus stelleri, Myoxocephalus stelleri, Myoxocephalus polyacanthocephalus, Megalocottus platycephalus, Enophrys diceraus, Argyrocottus zanderi, Myoxocephalus brandtii, Radulinus asprellus, Taurulus bubalis, Malacocottus kincaidi;Malacocottus gibber;Malacocottus sp. HUMZ:215076;Malacocottus sp. HUMZ:222544, Malacocottus gibber, Malacocottus zonurus, Leptocottus armatus, Icelus spiniger, Mesocottus haitej","0, 5, 6, 7, 8, 9, 10","320617",320617,"Eukaryota","Chordata","Actinopteri","Perciformes","Cottidae","Enophrys","Enophrys bison","gi|985563242|dbj|LC091925.1|, gi|2314981980|ref|NC_066929.1|, gi|669175209|gb|KM057956.1|",100,"CACCGCGGTTATACGAGAGGCCCAAGTTGACAAACACCGGCGTAAAGCGTGGTTAAGAAAAATTCACACTAAAGCCAAACATCTTCCAGGCTGTTATACGCAATCGAAGATAGGAAGTTCAACCACGAAGGTGGCTTTATCTAACCTGAACCCACGAAAGCTA","2025-08-12"
"5","08cc9127b29d3080a832db5f4cf68413a4d196f8","Leptocottus armatus",2,"Leptocottus armatus, N/A, Cottus czerskii, Taurocottus bergii, Cottus ricei, Cottus asper, Cottus beldingii, Cottus pollux, Cottus marginatus, Cottus perplexus, Cottus gulosus, Batrachocottus baicalensis, Cottocomephorus grewingki, Paracottus knerii, Cottus gobio, Comephorus baikalensis, Batrachocottus talievi, Batrachocottus nikolskii, Batrachocottus multiradiatus, Mesocottus haitej, Procottus major, Cottocomephorus inermis, Cottus cognatus, Cottus bairdii, Cottus hangiongensis, Cottus aleuticus","1, 2, 4, 3, 5","214925",214925,"Eukaryota","Chordata","Actinopteri","Perciformes","Cottidae","Leptocottus","Leptocottus armatus","gi|2580315490|gb|OR582704.1|, gi|985563247|dbj|LC091930.1|",99.387,"CACCGCGGTTATACGAGAGGCCCAAGTTGACAAACACCGGCGTAAAGCGTGGTTAAGTTAATAAATCACACTAAAGCCAAACATCTTCAAGACTGTTATACGTAACCGAAGACAGGAAGTTCAACCACGAAAGTGGCTTTATCTGATCTGAGCCCACGAAAGC","2025-08-12"
"6","0bf4c48f3ad2a3cc4e34666e5c4b135873c1e014","Cryptacanthodes maculatus",1,"Cryptacanthodes maculatus, Cryptacanthodes giganteus, Andriashevia sp. CBM:ZF:16351-1;Andriashevia sp. CBM:ZF:16351-2, Cryptacanthodes bergi, Eumesogrammus praecisus, Opisthocentrus ocellatus, Ulvaria subbifurcata, Zaprora silenus, Opisthocentrus tenuis, Stichaeopsis nana, Askoldia variegata, Kasatkia memorabilis, Pholidapus dybowskii, Xenolumpenus longipterus, Anisarchus medius, Opisthocentrus zonope, Ernogrammus hexagrammus, Poroclinus rothrocki, Ronquilus jordani, Lumpenella longirostris, Stichaeopsis nevelskoi, Anisarchus macrops, Dictyosoma rubrimaculatum, Stichaeus punctatus, Alectrias benjamini","1, 2, 3, 4, 5, 6","1266866",1266866,"Eukaryota","Chordata","Actinopteri","Perciformes","Cryptacanthodidae","Cryptacanthodes","Cryptacanthodes maculatus","gi|2329468156|gb|OP056918.1|",99.387,"CACCGCGGTTATACGAGAGGCCCAAGTTGAAAGACATCGGCGTAAAGAGTGGTTAAGTTAAAATTTATACTAAAGCCGAACATCCTCAAGGCTGTTATACGCACCCGAAGATAAGAAGTTCAACCACGAAAGTGGCTTTATTTAAGCTGAACCCACGAAAGCT","2025-08-12"
"7","0d5bb5e606e44a585e5c7e6c929d78aa471d1635","Citharichthys stigmaeus",1,"Citharichthys stigmaeus, Citharichthys cornutus, Etropus microstomus, Etropus crossotus, Citharichthys sordidus, Citharichthys xanthostigma, Citharichthys arctifrons","1, 2, 4, 7, 8, 9, 11, 12","319775",319775,"Eukaryota","Chordata","Actinopteri","Pleuronectiformes","Cyclopsettidae","Citharichthys","Citharichthys stigmaeus","gi|985563397|dbj|LC092080.1|",99.387,"CACCGCGGTTATACGAGAGGCTCAAGTTGATAGACAGCGGCGTAAAGAGTGGTTAGGGAAATATATAAACTAAAGTCGAACGCTTCCACAGCTGTTATACGCACCCGAAAACATGAAGCCCAACTACGAAAGTGACTTTAAGACACCTGAACCCACGAAAGCT","2025-08-12"
"8","0e275486a64b0a41ff6d4db34355c620c23221df","Hypomesus",1,"Hypomesus pretiosus, Hypomesus transpacificus, Spirinchus thaleichthys, Thaleichthys pacificus, Allosmerus elongatus, Osmerus mordax, Osmerus mordax dentex, Hypomesus olidus, Spirinchus starksi, Hypomesus nipponensis, Plecoglossus altivelis ryukyuensis, Plecoglossus altivelis altivelis, Plecoglossus altivelis, Mallotus villosus, Neosalangichthys ishikawae, Salangichthys microdon","0, 1, 4, 5, 6, 7, 8, 9, 10","300346 137520",137519,"Eukaryota","Chordata","Actinopteri","Osmeriformes","Osmeridae","Hypomesus","","gi|985566938|dbj|LC091605.1|, gi|2459373154|ref|NC_072210.1|, gi|2314981644|ref|NC_066905.1|",100,"CACCGCGGTTATACGAGTGGCCCAAGTTGAAAGTTACCGGCGTAAAGAGTGGTTAGGGAAACAATAAACTAAAGCCGAACACCCTCTAGGCTGTTATACGCTTCTGAGGGCACGAAGCCCCACTACGAAAGTGGCTTTAATTCACCTGAACCCACGACAGCTA","2025-08-12"
"9","0e795cfdc9e6f0ca6456e67bd395d126a12e6275","Clupea pallasii",1,"Clupea pallasii, Sprattus muelleri, Sprattus antipodum, Ethmidium maculatum","1, 2, 11, 12, 13","30724",30724,"Eukaryota","Chordata","Actinopteri","Clupeiformes","Clupeidae","Clupea","Clupea pallasii","gi|985566912|dbj|LC091579.1|",99.387,"CACCGCGGTTATACGAGAGACCCTAGTTGATATACTCGGCGTAAAGAGTGGTTATGGAAAACAAACACTAGAGCCAAAGAGCCCTCAGGCCGTTATACGCACCCGGGGCCTCGAACCACTATCACGAAAGTAGCTTTACCCTCGCCCACCAGAACCCACGAGA","2025-08-12"
"10","0eb51c20cfd512b81368f40b8449b5ca2710919d","Pholis laeta",1,"Pholis laeta, Pholis gunnellus, Pholis ornata, Pholis crassispina;Pholis picta;Pholis clemensi, Pholis crassispina, Pholis picta, Pholis nebulosa, Eumesogrammus praecisus, Opisthocentrus ocellatus, Pholidapus dybowskii, Ulvaria subbifurcata, Askoldia variegata, Rhodymenichthys dolichogaster, Lumpenella longirostris, Alectrias benjamini, Pholis fangi, Apodichthys flavidus, Xenolumpenus longipterus, Stichaeopsis nevelskoi, Stichaeus punctatus, Anisarchus medius, Stichaeopsis nana, Dictyosoma burgeri, Anisarchus macrops","1, 2, 3, 4, 5, 6, 7","283367",283367,"Eukaryota","Chordata","Actinopteri","Perciformes","Pholidae","Pholis","Pholis laeta","gi|985563337|dbj|LC092020.1|",99.387,"CACCGCGGTTATACGAGAGGCCCAAGTTGAAAGACATCGGCGTAAAGAGTGGTTAAGTTAAAATTGTACTAAAGCCGAACATCCTCGAGGCTGTTATACGCATCCGAAGATAAGAAGTTCAACCACGAAGGTAGCTTTATTTAGTCTGAACCCACGAAAGCTA","2025-08-12"
"11","0eb65725730ae69e089bbea9ceafad0064b2a771","Stichaeidae",1,"Chirolophis japonicus, Opisthocentrus tenuis, Ernogrammus hexagrammus, Bryozoichthys lysimus, Chirolophis decoratus;Chirolophis nugator, Chirolophis wui, Chirolophis ascanii, Eumesogrammus praecisus, Opisthocentrus ocellatus, Ulvaria subbifurcata, Stichaeus punctatus, Xiphister atropurpureus, Zaprora silenus, Cryptacanthodes maculatus, Alectrias alectrolophus, Stichaeopsis sp. HUMZ:198853, Stichaeopsis nana, Chirolophis saitonis, Askoldia variegata, Cryptacanthodes giganteus, Phytichthys chirus, Xiphister mucosus, Leptoclinus maculatus, Dictyosoma tongyeongensis, Kasatkia memorabilis, Alectrias benjamini, Dictyosoma rubrimaculatum, Anisarchus macrops","9, 10, 11","476915 476930 641279 1317002 320615 433395 1358730 2719052",30892,"Eukaryota","Chordata","Actinopteri","Perciformes","Stichaeidae","","","gi|995891252|dbj|LC081980.1|, gi|985566757|dbj|LC069692.1|, gi|985566746|dbj|LC069681.1|, gi|985566744|dbj|LC069679.1|, gi|985566734|dbj|LC069669.1|, gi|985563325|dbj|LC092008.1|, gi|937547063|ref|NC_028022.1|, gi|2386961653|ref|NC_068730.1|, gi|2195008637|dbj|LC385119.2|, gi|2073950700|gb|MT006232.1|, gi|1980526710|ref|NC_052765.1|",94.479,"CACCGCGGTTATACGAGAGGCCCAAGTTGATGGACATCGGCGTAAAGAGTGGTTAAGTTGGAATTTATACTAAAGCCGAACGTCCTCAAGGCTGTTATACGCACCCGAGGATAAGAAGTTCAACCACGAAAGTGACTTTATTTCATCTGAACCCACGAAAGCT","2025-08-12"
"12","0eedd3b33db3c319668d6182d374877140a10813","Clupea pallasii",2,"Clupea pallasii, Sprattus muelleri, Sprattus antipodum, Ethmidium maculatum","2, 3, 11, 12","30724",30724,"Eukaryota","Chordata","Actinopteri","Clupeiformes","Clupeidae","Clupea","Clupea pallasii","gi|1848856272|dbj|LC552350.1|, gi|985564913|dbj|LC020932.1|, gi|148922558|ref|NC_009578.1|, gi|985566912|dbj|LC091579.1|, gi|117671448|gb|DQ912047.1|",98.773,"CACCGCGGTTATACGAGAGACCCTAGTTGATATACTCGGCGTAAAGAGTGGTTATGGAGAACAAGCACTAAAGCCAAAGAGCCCTCAGGCCGTTATACGCACCCAGGGCCTCGAACCACTATCACGAAAGTAGCTTTACCCTCGCCCACCAGAACCCACGAGA","2025-08-12"
"13","0f076a67ed12760b54eb679237c2b87be2f6a942","Sus scrofa",1,"Sus scrofa, Sus scrofa domesticus, Sus scrofa;Sus scrofa domesticus","0, 1","9823 9825 9823 9825",9823,"Eukaryota","Chordata","Mammalia","Artiodactyla","Suidae","Sus","Sus scrofa","gi|1777435045|gb|MK248682.1|, gi|1777435031|gb|MK248681.1|, gi|2727911206|gb|PP763977.1|, gi|2727911192|gb|PP763976.1|, gi|2727910534|gb|PP763929.1|, gi|2727910492|gb|PP763926.1|, gi|1139382436|dbj|LC104812.1|, gi|982189145|gb|KT279760.1|, gi|1013824879|gb|KT372134.1|, gi|2519026283|pdb|8OIN|AA, gi|2509606814|pdb|8OIP|AA, gi|2321859529|gb|OM236539.1|, gi|704366787|gb|KM224340.1|, gi|704366782|gb|KM224339.1|, gi|725611233|gb|KM520143.1|, gi|669176308|gb|KJ746666.1|, gi|2120245608|gb|MT483613.1|, gi|556571580|gb|KF569218.1|, gi|810516680|pdb|5AJ3|A, gi|347448639|gb|JN601068.1|, gi|347448611|gb|JN601066.1|, gi|459353574|gb|KC469587.1|, gi|443611020|gb|KC250275.1|, gi|223976078|ref|NC_012095.1|, gi|209166268|gb|FJ237003.1|, gi|209166198|gb|FJ236998.1|, gi|209166184|gb|FJ236997.1|, gi|209166142|gb|FJ236994.1|, gi|5835862|ref|NC_000845.1|, gi|33320837|gb|AF486866.1|, gi|33320725|gb|AF486858.1|, gi|12700652|gb|AY012145.1|, gi|11055671|gb|AF304203.1|AF304203, gi|82524151|emb|AM158316.1|, gi|45826183|gb|AY574046.1|",100,"CACCGCGGTCATACGATTAACCCAAATTAATAGATCCACGGCGTAAAGAGTGTTTAAGAAAAAAAATCACAATAGAGTTAAATTATAACTAAGCTGTAAAAAGCCCTAGTTAAAATAAAATAACCCACGAAAGTGACTCTAATAATCCTGACACACGATAGCT","2025-08-12"
"14","11294b578e991160349eec73d867f6f02d2c33c4","Clupea pallasii",3,"Clupea pallasii, Sprattus muelleri, Sprattus antipodum, Ethmidium maculatum, Sprattus fuegensis","1, 2, 8, 9, 0, 10","30724",30724,"Eukaryota","Chordata","Actinopteri","Clupeiformes","Clupeidae","Clupea","Clupea pallasii","gi|117671448|gb|DQ912047.1|",100,"CACCGCGGTTATACGAGAGACCCTAGTTGATACACTCGGCGTAAAGAGTGGTTATGGAAAACAAGCACTAAAGCCAAAGAGCCCTCAGGCCGTTATACGCACCCGGGGCCTCGAACCACTATCACGAAAGTAGCTTTACCCTCGCCCACCAGAACCCACGAGA","2025-08-12"
"15","11b304fefce984d10ced58b9b5a87494f7ac33aa","Clupea pallasii",4,"Clupea pallasii, Sprattus muelleri, Sprattus antipodum, Ethmidium maculatum","2, 3, 11, 12, 13","30724",30724,"Eukaryota","Chordata","Actinopteri","Clupeiformes","Clupeidae","Clupea","Clupea pallasii","gi|1848856272|dbj|LC552350.1|, gi|985564913|dbj|LC020932.1|, gi|148922558|ref|NC_009578.1|, gi|985566912|dbj|LC091579.1|, gi|117671448|gb|DQ912047.1|",98.773,"CACCGCGGTTATACGAGAGACCCTAGTTGATATACTCGGCGTAAAGAGTGGTTATGGAAAACAAACACTGAAGCCAAAGAGCCCTCAGGCCGTTATACGCACCCGGGGCCTCGAACCACTATCACGAAAGTAGCTTTACCCTCGCCCACCAGAACCCACGAGA","2025-08-12"
"16","11eeb975c8e38d5bef457dbb563877416c7b8d2c","Phytichthys chirus",1,"Phytichthys chirus, Bryozoichthys lysimus, Chirolophis decoratus;Chirolophis nugator, Eumesogrammus praecisus, Opisthocentrus ocellatus, Pholidapus dybowskii, Ulvaria subbifurcata, Stichaeus punctatus, Xiphister atropurpureus, Alectrias alectrolophus, Stichaeopsis sp. HUMZ:198853, Askoldia variegata, Xiphister mucosus, Leptoclinus maculatus, Alectrias benjamini, Anisarchus medius, Chirolophis japonicus, Ernogrammus hexagrammus, Poroclinus rothrocki, Lumpenella longirostris, N/A;Stichaeus sp. HUMZ:205628;Dinogunellus grigorjewi, Chirolophis wui, N/A, Xenolumpenus longipterus, Stichaeopsis nevelskoi, Dinogunellus grigorjewi, Anisarchus macrops, Chirolophis ascanii","0, 3, 4, 5","1738904",1738904,"Eukaryota","Chordata","Actinopteri","Perciformes","Stichaeidae","Phytichthys","Phytichthys chirus","gi|985563329|dbj|LC092012.1|",100,"CACCGCGGTTATACGAGAGGCCCAAGTTGACAGACATCGGCGTAAAGAGTGGTTAAGTTAAAATTTGTACTAAAGCCGAACGTCTTCAAGGCTGTTATACGCACCCGAGGATAAGAAGTTCAACCACGAAGGTGGCTTTATTTAGTCTGAACCCACGAAAGCT","2025-08-12"
"17","12184344917573cc79d0c560df15739788e66279","Clupea pallasii",5,"Clupea pallasii, Sprattus muelleri, Sprattus antipodum, Ethmidium maculatum","1, 2, 10, 11, 12","30724",30724,"Eukaryota","Chordata","Actinopteri","Clupeiformes","Clupeidae","Clupea","Clupea pallasii","gi|1848856272|dbj|LC552350.1|, gi|985564913|dbj|LC020932.1|, gi|148922558|ref|NC_009578.1|",99.387,"CACCGCGGTTATACGAGAGACCCTAGTTGATATACTCGGCGTAAAGAGTGGTTATGGAAAACAAGCACTAAAGCCAAAGAGCCCTCAGGCCGTTATACGCACCCGGGGCCTCGAACCATTATCACGAAAGTAGCTTTACCCTCGCCCACCAGAACCCACGAGA","2025-08-12"
"18","122c00aef2ab9969328d5910ec5f77567bff6af2","Pholis",1,"Pholis ornata, Pholis gunnellus, Pholis laeta, Pholis crassispina;Pholis picta;Pholis clemensi, Pholis crassispina, Pholis picta, Pholis nebulosa, Lumpenella longirostris, Stichaeus punctatus, Eumesogrammus praecisus, Pholis fangi, Zaprora silenus, Stichaeopsis epallax, Pholidapus dybowskii, Askoldia variegata, Opisthocentrus ocellatus, Rhodymenichthys dolichogaster, Alectrias benjamini, Dictyosoma burgeri","2, 3, 4, 5, 6, 7, 8","283028 56726 283367",56725,"Eukaryota","Chordata","Actinopteri","Perciformes","Pholidae","Pholis","","gi|985563335|dbj|LC092018.1|, gi|2314982022|ref|NC_066932.1|, gi|1515576542|gb|MH377827.1|, gi|985563337|dbj|LC092020.1|",98.773,"CACCGCGGTTATACGAGAGGCCCAAGTTGATAGACATCGGCGTAAAGAGTGGTTAAGTTAAAACTGTACTAAAGCCGAACATCCTCCAGGCTGTTATACGCATCCGAAGATAAGAAGTTCAACCACGAAAGTAGCTTTATTTAGTCTGAACCCACGAAAGCTA","2025-08-12"
"19","1408b341b3489b5e7e2f721f7becf04de593dcf3","Podothecus accipenserinus",1,"Podothecus accipenserinus, Leptagonus decagonus, Podothecus sachi, Podothecus veternus, Sarritor frenatus, Podothecus sachi;Podothecus sturioides, Sarritor leptorhynchus, Ulcina olrikii, Freemanichthys thompsoni, Hemitripterus villosus, Hemitripterus bolini, Leptocottus armatus, Hemitripterus americanus, Hexagrammos otakii, Cottus asper, Cottus perplexus, Cottus gulosus, Brachyopsis segaliensis, Blepsias cirrhosus, Batrachocottus baicalensis, Cottocomephorus grewingki, Cottus gobio","0, 2, 3, 4, 5","320612",320612,"Eukaryota","Chordata","Actinopteri","Perciformes","Agonidae","Podothecus","Podothecus accipenserinus","gi|2571476576|gb|OR499735.1|, gi|985563638|dbj|LC104553.1|, gi|669175233|gb|KM057980.1|",100,"CACCGCGGTTATACGAGAGGCCCAAGTTGATAGCCACCGGCGTAAAGCGTGGTTAAGTTAAAAATCATACTAAAGCCAAACATCTTCAAGACTGTTATACGTAACCGAAGACAGGAAGTTCAACCACGAAAGTGGCTTTATTGATCTGAACCCACGAAAGCTA","2025-08-12"
"20","146215e76e95288bf7097b92c5e1e66115ecac45","Clupea pallasii",6,"Clupea pallasii, Sprattus muelleri, Sprattus antipodum, Ethmidium maculatum","1, 2, 10, 11, 12","30724",30724,"Eukaryota","Chordata","Actinopteri","Clupeiformes","Clupeidae","Clupea","Clupea pallasii","gi|1848856272|dbj|LC552350.1|, gi|985564913|dbj|LC020932.1|, gi|148922558|ref|NC_009578.1|",99.387,"CACCGCGGTTATACGAGAGACCCTAGTTGATATACTCGGCGTAAAGAGTGGTTGTGGAAAACAAGCACTAAAGCCAAAGAGCCCTCAGGCCGTTATACGCACCCGGGGCCTCGAACCACTATCACGAAAGTAGCTTTACCCTCGCCCACCAGAACCCACGAGA","2025-08-12"
"21","153ef65649f556f6eae6c36a1fe0ea2dbe5fe710","Oncorhynchus tshawytscha",1,"Oncorhynchus tshawytscha, Oncorhynchus nerka, Parahucho perryi, Oncorhynchus clarkii stomias, Oncorhynchus clarkii henshawi, Oncorhynchus mykiss gairdneri, Oncorhynchus mykiss irideus, Oncorhynchus mykiss newberrii, Oncorhynchus kawamurae, Oncorhynchus mykiss, Oncorhynchus keta;Oncorhynchus nerka, Salvelinus leucomaenis, Oncorhynchus clarkii virginalis, Oncorhynchus gilae apache, Oncorhynchus gilae, Salvelinus leucomaenis leucomaenis, Salvelinus leucomaenis japonicus, Salmo labrax, Oncorhynchus gorbuscha, Oncorhynchus kisutch","1, 2, 4, 3, 5","74940",74940,"Eukaryota","Chordata","Actinopteri","Salmoniformes","Salmonidae","Oncorhynchus","Oncorhynchus tshawytscha","gi|985566961|dbj|LC091628.1|, gi|2329041622|gb|ON005616.1|, gi|2305126625|gb|OL693876.1|, gi|2305126393|gb|OL404930.1|, gi|2264236735|dbj|LC717563.1|, gi|307640018|gb|HQ167665.1|, gi|14647165|ref|NC_002980.1|",99.387,"CACCGCGGTTATACGAGAGACCCTAGTTGATAACTACCGGCGTAAAGAGTGGTTATGGAAAAATATTTAATAAAGCCGAACACCCCCTCAGCCGTCATACGCACCTGGGGGCACGAAGACCTACTGCGAAAGCAGCTTTAATTACACCTGACCCCACGACAGC","2025-08-12"
"22","16477cdd519262a7bbe725adace6e3f703db5191","Leptocottus armatus",3,"Leptocottus armatus, N/A, Cottus czerskii, Taurocottus bergii, Cottus ricei, Cottus asper, Cottus beldingii, Cottus marginatus, Cottus perplexus, Cottus gulosus, Batrachocottus baicalensis, Cottocomephorus grewingki, Cottus gobio, Cottus bairdii, Triglops scepticus, Cottocomephorus inermis, Comephorus baikalensis, Batrachocottus talievi, Batrachocottus nikolskii, Batrachocottus multiradiatus, Mesocottus haitej, Procottus major, Cottus cognatus, Cottus hangiongensis, Cottus aleuticus, Cottus pollux","0, 1, 4, 3, 5","214925",214925,"Eukaryota","Chordata","Actinopteri","Perciformes","Cottidae","Leptocottus","Leptocottus armatus","gi|73611138|dbj|AB188194.1|",100,"CACCGCGGTTATACGAGAGGCCCAAGTTGACGAACACCGGCGTAAAGCGTGGTTAAGTTAATAAATCACACTAAAGCCAAACATCTTCAAGACTGTTATACGTAACCGAAGACAGGAAGTTCAACCACGAAAGTGGCTTTATCTGATCTGAACCCACGAAAGC","2025-08-12"
"23","16aef7b1ba177a7354d5d8b13c9be37d272fa4d1","Triglops pingelii",1,"Triglops pingelii, Triglops forficatus, Triglops murrayi, Triglops jordani, Triglops scepticus, Radulinus boleoides, Eurymen gyrinus, Ebinania vermiculata, Artediellus pacificus, Artediellus scaber, Gymnocanthus tricuspis, Hexagrammos otakii, Artediellus sp. HUMZ:166735, Psychrolutes phrictus, Radulinus asprellus, Taurocottus bergii, Artediellus uncinatus, Malacocottus kincaidi;Malacocottus gibber;Malacocottus sp. HUMZ:215076;Malacocottus sp. HUMZ:222544, Triglops macellus, Hexagrammos octogrammus;Hexagrammos agrammus;Hexagrammos lagocephalus;Hexagrammos stelleri, Hexagrammos lagocephalus, Hexagrammos agrammus, Malacocottus gibber, Malacocottus zonurus, Icelus spiniger, Cottunculus thomsonii, Gymnocanthus galeatus, Hexagrammos octogrammus","1, 2, 3, 4, 5, 6, 7, 8","433391",433391,"Eukaryota","Chordata","Actinopteri","Perciformes","Cottidae","Triglops","Triglops pingelii","gi|985563226|dbj|LC091909.1|",99.387,"CACCGCGGTTATACGAGAGGCCCAAGTTGACAGACACCGGCGTAAAGAGTGGTTAAGTTAAAACTCATACTAAAGCCCAACATCTTCAAGGCTGTTATACGCAACCGAAGACAGGAGGTTCAACCACGAAAGTGGCTTTATCTGATCTGACCCCACGAAAGCT","2025-08-12"
"24","16ddbc5985030dcd5f965675ef8e202fd0a90734","Citharichthys stigmaeus",2,"Citharichthys stigmaeus, Citharichthys cornutus, Citharichthys sordidus, Citharichthys xanthostigma, Citharichthys arctifrons, Etropus microstomus, Etropus crossotus, Citharichthys macrops","0, 1, 3, 6, 7, 9, 8, 10, 11, 12","319775",319775,"Eukaryota","Chordata","Actinopteri","Pleuronectiformes","Cyclopsettidae","Citharichthys","Citharichthys stigmaeus","gi|2587933730|ref|NC_083050.1|",100,"CACCGCGGTTATACGAGAGGCTCAAGTTGATAGACAGCGGCGTAAAGAGTGGTTAGGGAAATATATAAACTAAAGTCGAACGCTTCCATAGCTGTTATACGCACCCGAAAACATGAAGCCCAACTACGAAAGTGACTTTAAAACACCTGAACCCACGAAAGCT","2025-08-12"
"25","17f4b158558e1f081668c93d970fdaa198b15164","Clupea pallasii",7,"Clupea pallasii, Sprattus muelleri, Sprattus antipodum, Ethmidium maculatum","1, 2, 10, 11, 12","30724",30724,"Eukaryota","Chordata","Actinopteri","Clupeiformes","Clupeidae","Clupea","Clupea pallasii","gi|1848856272|dbj|LC552350.1|, gi|985564913|dbj|LC020932.1|, gi|148922558|ref|NC_009578.1|",99.387,"CACCGCGGTTATACGAGAGACCCTAGTTGATATACTCGGCGTAAAGAGTGGTTATGGAAAACAAGCACTAAAGCCAAAGGGCCCTCAGGCCGTTATACGCACCCGGGGCCTCGAACCACTATCACGAAAGTAGCTTTACCCTCGCCCACCAGAACCCACGAGA","2025-08-12"
"26","181b53679beaa94268d17399356664a15a0f3078","Clupea pallasii",8,"Clupea pallasii, Sprattus muelleri, Sprattus antipodum, Ethmidium maculatum","2, 3, 11, 12, 13","30724",30724,"Eukaryota","Chordata","Actinopteri","Clupeiformes","Clupeidae","Clupea","Clupea pallasii","gi|1848856272|dbj|LC552350.1|, gi|985564913|dbj|LC020932.1|, gi|148922558|ref|NC_009578.1|, gi|985566912|dbj|LC091579.1|, gi|117671448|gb|DQ912047.1|",98.773,"CACCGCGGTTATACGAGAGACCCTAGTTGATATACTCGGCGTAAAGAGTGGTTATGGAAAACAAGCATGAAAGCCAAAGAGCCCTCAGGCCGTTATACGCACCCGGGGCCTCGAACCACTATCACGAAAGTAGCTTTACCCTCGCCCACCAGAACCCACGAGA","2025-08-12"
"27","188e4b6b1a3ce1d0fdb2a9ca92c1eb8411e4b6c1","Pleuronectidae",1,"Platichthys stellatus, Myzopsetta ferruginea, Platichthys flesus, Liopsetta glacialis, Platichthys stellatus x Verasper variegatus, Platichthys stellatus x (Kareius bicoloratus x Platichthys stellatus), Kareius bicoloratus x Platichthys stellatus, Platichthys stellatus;Liopsetta pinnifasciata;Platichthys stellatus x Parophrys vetulus, Glyptocephalus zachirus, Pleuronectes quadrituberculatus, Parophrys vetulus, Psettichthys melanostictus, Hippoglossoides elassodon, Myzopsetta proboscidea, Hippoglossoides robustus, Isopsetta isolepis, Kareius bicoloratus, Limanda aspera, Glyptocephalus stelleri, Glyptocephalus zachirus;Glyptocephalus stelleri, Hippoglossoides elassodon;Acanthopsetta nadeshnyi;Hippoglossoides robustus, Pseudopleuronectes americanus, Hippoglossoides platessoides","0, 1","195632 8258 8260 1402070 3070152 3041670 1565084 195632 382950 1828372",8256,"Eukaryota","Chordata","Actinopteri","Pleuronectiformes","Pleuronectidae","","","gi|1848856403|dbj|LC552481.1|, gi|1825511888|gb|MT103916.1|, gi|1515576540|gb|MH377825.1|, gi|2745580202|gb|PP928767.1|, gi|2587926480|ref|NC_082783.1|, gi|2577880658|ref|NC_082285.1|, gi|2524645126|ref|NC_080271.1|, gi|2524645112|ref|NC_080270.1|, gi|906357418|dbj|AB972099.1|, gi|2305131859|gb|OL471033.1|, gi|2305131466|gb|OL404931.1|, gi|2272657037|gb|MZ365029.1|, gi|190349412|ref|NC_010966.1|, gi|22532242|gb|AF488482.1|",100,"CACCGCGGTTATACGAGAGGCCCAAGTTGACAAACAACGGCGTAAAGAGTGGTTAGGGGATTTACTAAACTAGAGCCGAACGCTTTCAAAGCTGTTATACGCACCCGAAAGTATGAAACCCAATTACGAAAGTAGCTCTACCTATCCTGAACCCACGAAAGCT","2025-08-12"
"28","194dd92f88eb1c3bd02d23f2b477b883a4d1fa56","Liparis florae",1,"Liparis florae, Polypera greeni, Liparis cyclopus, Rhodichthys regina, Careproctus sp. OCF-P20080722-1, Liparis ochotensis, Rhinoliparis attenuatus, Liparis gibbus, Liparis bathyarcticus, Liparis miostomus, Liparis tanakae, Liparis tessellatus, Paraliparis meridionalis, Squaloliparis dentatus, Paraliparis sp. NSMT P92399, Paraliparis dipterus, Nectoliparis pelagicus, Psednos groenlandicus, Liparis fabricii, Liparis inquilinus, Rhinoliparis barbulifer, Liparis fucensis, Liparis dennyi, Paraliparis copei, Paraliparis cephalus, Psednos melanocephalus, Liparis agassizii, Careproctus roseofuscus, Careproctus marginatus, Lipariscus nanus","0, 8, 9, 10, 11, 12, 13, 14","320618",320618,"Eukaryota","Chordata","Actinopteri","Perciformes","Liparidae","Liparis","Liparis florae","gi|985563669|dbj|LC104584.1|",100,"CACCGCGGTTATACGAGAGGCCCAAGTTGAAAGACACCGGCGTAAAGCGTGGTTAAATTAAAATTATAAGCTAAAGTTAAACATCTTCAAAACTGTTATACGTATACGAAGACAGGAATCTCAACTACGAAAGTGACTTTATACAAGTTGAACCCACGAAAGC","2025-08-12"
