"","Hash","BestTaxon","HaplotypeNumber","Tax_list","Mismatches","BlastTaxIDs","LCA_taxid","Kingdom","Phylum","Class","Order","Family","Genus","Species","AccessionNumbers","Max_pident","Sequence","DateAdded"
"114","6d62c7855473c179138e094b261d56546b23750c","Pleuronectidae",3,"Parophrys vetulus, Isopsetta isolepis, Psettichthys melanostictus, Platichthys stellatus, Myzopsetta ferruginea, Platichthys flesus, Lepidopsetta polyxystra, Liopsetta glacialis, Platichthys stellatus x Verasper variegatus, Lepidopsetta bilineata, Lepidopsetta mochigarei, Platichthys stellatus x (Kareius bicoloratus x Platichthys stellatus), Kareius bicoloratus x Platichthys stellatus, Platichthys stellatus;Liopsetta pinnifasciata;Platichthys stellatus x Parophrys vetulus, Pleuronectes quadrituberculatus, Limanda aspera, Glyptocephalus zachirus, Glyptocephalus stelleri, Glyptocephalus zachirus;Glyptocephalus stelleri, Kareius bicoloratus, Hippoglossoides elassodon;Acanthopsetta nadeshnyi;Hippoglossoides robustus, Pseudopleuronectes americanus, Hippoglossoides platessoides","1, 2, 3","172659 195617 195639",8256,"Eukaryota","Chordata","Actinopteri","Pleuronectiformes","Pleuronectidae","","","gi|2373975304|gb|OP035309.1|, gi|2571476604|gb|OR499737.1|, gi|2569353389|gb|OR482580.1|, gi|2587926803|ref|NC_082806.1|, gi|1018242347|dbj|LC145941.1|, gi|1018242344|dbj|LC145938.1|, gi|1018242343|dbj|LC145937.1|, gi|1018242342|dbj|LC145936.1|, gi|1018242331|dbj|LC145925.1|, gi|1018242330|dbj|LC145924.1|, gi|1018241275|dbj|LC145950.1|, gi|2314981994|ref|NC_066930.1|, gi|22532245|gb|AF488485.1|, gi|22532241|gb|AF488481.1|",99.387,"CACCGCGGTTATACGAGAGGCCCAAGTTGACAAACAACGGCGTAAAGAGTGGTTAGGGGATTTAATAAACTAGGGCCGAACGCTTTCAAAGCTGTTATACGCACCCGAAAGTATGAAACCCAATTACGAAAGTAGCTCTACCTATCCTGAACCCACGAAAGCT","2025-08-12"
"115","6dc8232e6bfabdafa2419706c534c8445abce2ba","Artedius lateralis",1,"Artedius lateralis, Artedius harringtoni, Artedius fenestralis","1, 11, 14","322683",322683,"Eukaryota","Chordata","Actinopteri","Perciformes","Cottidae","Artedius","Artedius lateralis","gi|985563239|dbj|LC091922.1|",99.387,"CACCGCGGTTATACGAATGACCCAAGTTGACAGATACTCGGCGTAAAACGTGGCTAAGCTACACACTCCCACTAAAGCCAAACACCTTCAAAGCTGTGATACGCAATCGAAGGCAGGAAGTCCCACCACGAAAGTGGCTTTACCTAATCTGAGTCCACGAAAG","2025-08-12"
"116","6dd772fb50f2f75ac5c8a590c65084f5ef32528d","Ascelichthys rhodorus",1,"Ascelichthys rhodorus, Alcichthys elongatus, Icelinus borealis, Bero elegans, Astrocottus regulus, Plectobranchus evides, Chitonotus pugetensis, Icelinus filamentosus, Myoxocephalus aenaeus, Artediellus sp. HUMZ:166735, Psychrolutes paradoxus, Stlengis misakia, Icelus sekii, Icelinus pietschi, Myoxocephalus quadricornis, Radulinus asprellus, Lumpenus sagitta, Radulinus boleoides, Phasmatocottus ctenopterygius, Ricuzenius pinetorum, Trichocottus brashnikovi, Myoxocephalus scorpius, Zesticelus bathybius, Icelus mororanis, Myoxocephalus brandtii, Artediellus neyelovi, Icelus spiniger, Microcottus sellaris, N/A","0, 7, 9, 10, 11, 12, 13, 14","1738886",1738886,"Eukaryota","Chordata","Actinopteri","Perciformes","Cottidae","Ascelichthys","Ascelichthys rhodorus","gi|985563252|dbj|LC091935.1|",100,"CACCGCGGTTATACGAGAGGCCCAAGTTGACAAACACCGGCGTAAAGCGTGGTTAAGTTGAAACTCACACTAAAGCCAAACACCCTCAAAGCTGTTATACGCACCCGAGGGCAGGAAGTTCAACCACGAAGGTGGCTTTATTTAATCTGACTCCACGAAAGCT","2025-08-12"
"117","6ef5cb45723005a33b863565f4944bd40248c08d","Pholis",5,"Pholis ornata, Pholis gunnellus, Pholis laeta, Pholis crassispina;Pholis picta;Pholis clemensi, Pholis crassispina, Pholis picta, Pholis nebulosa, Pholis fangi, Rhodymenichthys dolichogaster, Lumpenella longirostris, Dictyosoma burgeri, Stichaeopsis nana, Pholidapus dybowskii, Ernogrammus hexagrammus, Askoldia variegata, Opisthocentrus ocellatus, Cryptacanthodes giganteus, Stichaeus punctatus, Alectrias benjamini, Eumesogrammus praecisus","0, 1, 2, 3, 4, 5, 7, 6","283028 56726",56725,"Eukaryota","Chordata","Actinopteri","Perciformes","Pholidae","Pholis","","gi|985563335|dbj|LC092018.1|, gi|2314982022|ref|NC_066932.1|, gi|1515576542|gb|MH377827.1|, gi|1980526482|ref|NC_052755.1|",98.78,"CACCGCGGTTATACGAGAGGCCCAAGTTGACAGACATCGGCGTAAAGAGTGGTTAAGTTAAAACTGTACTAAAGCCGAACATCCTCCAGGCTGTTATACGCATCCGAAGATAAGAAGTTCAACCACGAAGGTAGCTTTATTTAAGTCGAACCCACGAAAGCTA","2025-08-12"
"118","6f61b999a3de3491cb2520d079cd935bb1611a00","Artedius fenestralis",2,"Artedius fenestralis, Artedius lateralis","0, 13","274758",274758,"Eukaryota","Chordata","Actinopteri","Perciformes","Cottidae","Artedius","Artedius fenestralis","gi|985563227|dbj|LC091910.1|, gi|669175196|gb|KM057943.1|",100,"CACCGCGGTTATACGAGTGGCCCAAGTTGACAGACACTCGGCGTAAAACGTGGCTAGGCTAAACACTCAAACTAAAGCCGAACACCTTCTAAGCTGTGATACGCAATCGAAGGCAGGAAGCCCCACCACGAAAGTGGCTTTAACCTGAGCTGAACCCACGAAA","2025-08-12"
"119","6fc418eff553fb4bd17eb503aa324f443777bd12","Pholis",6,"Pholis crassispina;Pholis picta;Pholis clemensi, Pholis crassispina, Pholis picta, Pholis gunnellus, Pholis nebulosa, Pholis laeta, Pholis ornata, Eumesogrammus praecisus, Opisthocentrus ocellatus, Pholidapus dybowskii, Pholis fangi, Ulvaria subbifurcata, Askoldia variegata, Lumpenella longirostris, Alectrias benjamini, Dictyosoma burgeri, Anisarchus macrops","0, 1, 2, 3, 4","283025 283026 740703 283025 283026",56725,"Eukaryota","Chordata","Actinopteri","Perciformes","Pholidae","Pholis","","gi|985563333|dbj|LC092016.1|, gi|2504556390|dbj|LC385123.2|, gi|2504556286|dbj|LC767263.1|, gi|2231645270|ref|NC_062875.1|, gi|229484936|gb|FJ687232.1|, gi|25057905|ref|NC_004410.1|",100,"CACCGCGGTTATACGAGAGGCCCAAGTTGACAGACATCGGCGTAAAGAGTGGTTAAGTTAAAATTGTACTAAAGCCGAACATCCTCCAGGCTGTTATACGCATCCGAAGATAAGAAGTTCAACCACGAAGGTGGCTTTATTTAGTCTGAACCCACGAAAGCTA","2025-08-12"
"120","6fc6113c40ecaddaa8bbc3b96f73ba073da02719","Citharichthys stigmaeus",5,"Citharichthys stigmaeus, Citharichthys cornutus, Etropus microstomus, Citharichthys sordidus, Citharichthys xanthostigma, Citharichthys arctifrons, Etropus crossotus","0, 1, 4, 8, 7, 9, 10, 11","319775",319775,"Eukaryota","Chordata","Actinopteri","Pleuronectiformes","Cyclopsettidae","Citharichthys","Citharichthys stigmaeus","gi|985563397|dbj|LC092080.1|",100,"CACCGCGGTTATACGAGAGGCTCAAGTTGATAGACAGCGGCGTAAAGAGTGGTTAGGGAAATATATAAACTAAAGTCGAACGCTTCCATAGCTGTTATACGCACCCGAAAACATGAAGCCCAACTACGAAAGTGACTTTAAGACACCTGAACCCACGAAAGCT","2025-08-12"
"121","6fde98a1d9d6bd836c6943d3a3ecfc0f73b6be53","Gadus",4,"Gadus chalcogrammus, Gadus finnmarchicus, Gadus macrocephalus, Gadus ogac","0, 1, 2","1042646 3083464",8048,"Eukaryota","Chordata","Actinopteri","Gadiformes","Gadidae","Gadus","","gi|1783586485|gb|MH035604.1|, gi|1783586457|gb|MH035602.1|, gi|1783586429|gb|MH035600.1|, gi|1783586415|gb|MH035599.1|, gi|1783586387|gb|MH035597.1|, gi|1783586373|gb|MH035596.1|, gi|1783586331|gb|MH035593.1|, gi|1783586317|gb|MH035592.1|, gi|1783586303|gb|MH035591.1|, gi|1783586289|gb|MH035590.1|, gi|1783586275|gb|MH035589.1|, gi|1783586261|gb|MH035588.1|, gi|1783586247|gb|MH035587.1|, gi|1783586205|gb|MH035584.1|, gi|1783586191|gb|MH035583.1|, gi|985565183|dbj|LC021202.1|, gi|2186980144|gb|MW288643.1|, gi|2186980116|gb|MW288641.1|, gi|124377093|emb|AM489719.1|, gi|124377079|emb|AM489718.1|, gi|49658522|dbj|AB182308.1|, gi|49658494|dbj|AB182306.1|, gi|49658452|dbj|AB182303.1|, gi|49658438|dbj|AB182302.1|, gi|49658410|dbj|AB182300.1|, gi|27228478|ref|NC_004449.1|",100,"CACCGCGGTTATACGAGAGGCCCAAATTGATGAAAAACGGCGTAAAGCGTGGTTAAGAAAAAAAGAGAAAATATGGCCGAACAGCTTCAAAGCAGTTATACGCATCCGAAGTCACGAAGAACAATCACGAAAGTTGCCCTAAAACCTCCGATTCCACGAAAGC","2025-08-12"
"122","701806e42171bb51a4ddc408c2918ece4947b011","Sebastes mentella",1,"Sebastes mentella, Sebastes simulator, Sebastes helvomaculatus, Sebastes babcocki, Sebastes elongatus, Sebastes emphaeus, Sebastes rosenblatti, Sebastes rosaceus, Sebastes variegatus, Sebastes melanops, Sebastes brevispinis, Sebastes proriger, Sebastes flavidus, Sebastes miniatus, Sebastes goodei, Sebastes zacentrus, Sebastes wilsoni, Sebastes constellatus, Sebastes alutus, Sebastes diploproa, Sebastes longispinis, Sebastes alutus;Sebastes babcocki;Sebastes brevispinis;Sebastes elongatus;Sebastes emphaeus;Sebastes flavidus;Sebastes helvomaculatus;Sebastes melanops;Sebastes miniatus;Sebastes pinniger;Sebastes rosaceus;Sebastes ruberrimus;Sebastes zacentrus;Sebastes thompsoni;Sebastes joyneri;Sebastes inermis;Sebastes pachycephalus;Sebastes steindachneri;Sebastes taczanowskii;Sebastes aleutianus;Sebastes schlegelii;Sebastes proriger;Sebastes ventricosus;Sebastes nudus;Sebastes cheni, Sebastes thompsoni, Sebastes steindachneri, Sebastes hubbsi, Sebastes taczanowskii, Sebastes cheni, Sebastes pachycephalus, Sebastes joyneri, Sebastes owstoni, Sebastes ventricosus;Sebastes cheni, Sebastes schlegelii, Sebastes inermis, Sebastes norvegicus, Sebastes ventricosus, Sebastes oculatus, Sebastes wakiyai, Sebastes baramenuke, Sebastes viviparus, Sebastes ruberrimus","0, 1","394696",394696,"Eukaryota","Chordata","Actinopteri","Perciformes","Sebastidae","Sebastes","Sebastes mentella","gi|1790179376|dbj|LC493910.1|, gi|1391894989|dbj|LC385245.1|",100,"CACCGCGGCTATACGAGAGACCCAAGTTGATACCATCCGGCGTAAAGAGTGGTTATGGAAAATAAAGACTAAAGCCGCACACCTTCAAAGCTGTTATACGCATCCGAAGGCTAGAAGATCAACCACGAAGGTAGCTTTACAACCCCTGACCCCACGAAAGCTC","2025-08-12"
"123","7288406355747184a8ef4eb653d9207fa94a10e7","Anoplarchus",1,"Anoplarchus purpurescens, Anoplarchus purpurescens;Anoplarchus insignis, Leptoclinus maculatus, Anisarchus medius, Alectrias alectrolophus, Ernogrammus hexagrammus, Alectrias benjamini, Anisarchus macrops, Eumesogrammus praecisus, Opisthocentrus ocellatus, Ulvaria subbifurcata, Stichaeus punctatus, Xiphister atropurpureus, Zaprora silenus, Chirolophis japonicus, Opisthocentrus tenuis, Stichaeopsis nana, Askoldia variegata, Cryptacanthodes giganteus, Xiphister mucosus, Poroclinus rothrocki, Chirolophis wui, Kasatkia memorabilis, Dictyosoma rubrimaculatum, Chirolophis ascanii","1, 7, 8, 9","320623 320623 1225888",320622,"Eukaryota","Chordata","Actinopteri","Perciformes","Stichaeidae","Anoplarchus","","gi|985566742|dbj|LC069677.1|, gi|985563312|dbj|LC091995.1|",99.387,"CACCGCGGTTATACGAGAGGCCCAAGTTGACGGACATCGGCGTAAAGAGTGGTTAAGTTAAAATTCACACTAAAGCCGAACGTCCTCCAGGCTGTTATACGCACCCGAAGATAAGAAGTTCAATCACGAAAGTGGCTTTATTTAATCTGAACCCACGAAAGCT","2025-08-12"
"124","73686cf8f94b17264c6925de0c32bdd66a1369fd","Oncorhynchus gorbuscha",2,"Oncorhynchus gorbuscha, Oncorhynchus nerka, Oncorhynchus kawamurae, Oncorhynchus mykiss, Oncorhynchus mykiss nelsoni, Oncorhynchus chrysogaster, Oncorhynchus gilae, Oncorhynchus mykiss gairdneri, Oncorhynchus clarkii lewisi, Oncorhynchus mykiss irideus, Oncorhynchus mykiss newberrii, Oncorhynchus gilae apache, Oncorhynchus mykiss x Salmo salar, Oncorhynchus clarkii henshawi","1, 2, 3, 4","8017",8017,"Eukaryota","Chordata","Actinopteri","Salmoniformes","Salmonidae","Oncorhynchus","Oncorhynchus gorbuscha","gi|985566565|dbj|LC069500.1|, gi|190349300|ref|NC_010959.1|",99.387,"CACCGCGGTTATACGAGAGGCCCTAGTTGATAACTACCGGCGTAAAGAGTGGTTATGGAAAAATATTTAATAAAGCCGAACACCCCCTCAGCCGTCATACGCATCTGGGAGCACGAAGACCTACTGCGAAAGCAGCTTTAATTATGCCCGACCCCACGACAGC","2025-08-12"
"125","737abdd7d4204b2ccb5affd348ef3fcab3931c4a","Clupea pallasii",36,"Clupea pallasii","1, 2, 0","30724",30724,"Eukaryota","Chordata","Actinopteri","Clupeiformes","Clupeidae","Clupea","Clupea pallasii","gi|117671448|gb|DQ912047.1|",100,"CACCGCGGTTATACGAGAGACACTAGTTGATATACTCGGCGTAAAGAGTGGTTATGGAAAACAAGCACTAAAGCCAAAGAGCCCTCAGGCCGTTATACGCACCCGGGGCCTCGAACCACTATCACGAAAGTAGCTTTACCCTCGCCCACCAGAACCCACGAAA","2025-08-12"
"126","76d9342bcc7b5ff97b238a9deb14cbc7de0ecc62","Clupea pallasii",37,"Clupea pallasii, Sprattus muelleri, Sprattus antipodum, Ethmidium maculatum","2, 3, 11, 12","30724",30724,"Eukaryota","Chordata","Actinopteri","Clupeiformes","Clupeidae","Clupea","Clupea pallasii","gi|1848856272|dbj|LC552350.1|, gi|985564913|dbj|LC020932.1|, gi|148922558|ref|NC_009578.1|, gi|985566912|dbj|LC091579.1|, gi|117671448|gb|DQ912047.1|",98.773,"CACCGCGGTTATACGAGAGACCCTAGTTGATATACTCGGCGTAAAGAGTGGTTATGGAGAACAAGCACTAAGGCCAAAGAGCCCTCAGGCCGTTATACGCACCCGGGGCCTCGAACCACTATCACGAAAGTAGCTTTACCCTCGCCCACCAGAACCCACGAGA","2025-08-12"
"127","7852da19a739d8e77550fac69e6e4e86907f94a8","Oncorhynchus keta",3,"Oncorhynchus keta, Oncorhynchus nerka, Oncorhynchus kisutch, Oncorhynchus keta;Oncorhynchus nerka, Oncorhynchus kawamurae, Oncorhynchus mykiss, Oncorhynchus gilae, Oncorhynchus mykiss gairdneri, Oncorhynchus clarkii lewisi, Oncorhynchus mykiss irideus, Oncorhynchus mykiss newberrii, Oncorhynchus gilae apache, Oncorhynchus gorbuscha","1, 2, 3","8018",8018,"Eukaryota","Chordata","Actinopteri","Salmoniformes","Salmonidae","Oncorhynchus","Oncorhynchus keta","gi|985566566|dbj|LC069501.1|, gi|2305126365|gb|OL339394.1|, gi|2305126350|gb|OL339393.1|, gi|385843132|ref|NC_017838.1|, gi|2778079950|gb|PQ083393.1|",99.387,"CACCGCGGTTATACGAGAGGCCCTAGTTGATAACTGCCGGCGTAAAGAGTGGTTATGGAAAATATTTAATAAAGCCGAACACCCCCTCAGCCGTCATACGCACCTGGGAGCACGAAGACCTACCGCGAAAGCAGCTTTAATTATGCCTGACCCCACGACAGCT","2025-08-12"
"128","787b719f8176f1fe541d282dc6dc2c34bc18c5ff","Blepsias cirrhosus",1,"Blepsias cirrhosus, Blepsias bilobus, Percis japonica, Occella dodecaedron, Occella iburia, Tilesina gibbosa;Occella dodecaedron, Hypsagonus jordani, Bathyagonus infraspinatus, Bathyagonus alascanus, Chesnonia verrucosa, Chesnonia verrucosa;Pallasina barbata;Brachyopsis segaliensis, Brachyopsis segaliensis, Hemitripterus americanus, Hemilepidotus papilio, Hemilepidotus jordani, Hemilepidotus jordani;Hemilepidotus papilio, Agonopsis vulsa, Bathyagonus nigripinnis, Xeneretmus leiops, Xeneretmus latifrons;Bathyagonus nigripinnis, Sarritor leptorhynchus, Podothecus accipenserinus, Stellerina xyosterna, Hemitripterus villosus, Hemilepidotus gilberti, Odontopyxis trispinosa, Hemitripterus bolini, Hemilepidotus spinosus, Xeneretmus latifrons, Hemilepidotus zapus, Bathyagonus pentacanthus, Podothecus veternus, Sarritor frenatus, Podothecus sachi;Podothecus sturioides, Podothecus sachi","1, 2, 3, 5, 6, 7, 8","573213",573213,"Eukaryota","Chordata","Actinopteri","Perciformes","Agonidae","Blepsias","Blepsias cirrhosus","gi|2587926438|ref|NC_082780.1|, gi|669175201|gb|KM057948.1|",99.387,"CACCGCGGTTATACGAGAGGCCCAAGTTGATAACCACCGGCGTAAAGCGTGGTTAAGTTGAAACTCATACTAAAGTCAAACATCTTCAAGACTGTTATACGTAACCGAAGGCAGGAAGTTCAACCACGAAAGTGACTTTATTTGATCTGAACCCACGAAAGCT","2025-08-12"
"129","792ec4982def49c7004a0dde456ea68447f67e4c","Anoplarchus",2,"Anoplarchus purpurescens, Anoplarchus purpurescens;Anoplarchus insignis, Leptoclinus maculatus, Anisarchus medius, Opisthocentrus tenuis, Alectrias alectrolophus, Ernogrammus hexagrammus, Alectrias benjamini, Anisarchus macrops, Eumesogrammus praecisus, Opisthocentrus ocellatus, Ulvaria subbifurcata, Stichaeus punctatus, Xiphister atropurpureus, Zaprora silenus, Chirolophis japonicus, Stichaeopsis nana, Askoldia variegata, Cryptacanthodes giganteus, Xiphister mucosus, Poroclinus rothrocki, Chirolophis wui, Kasatkia memorabilis, Chirolophis ascanii","1, 7, 8, 9","320623 320623 1225888",320622,"Eukaryota","Chordata","Actinopteri","Perciformes","Stichaeidae","Anoplarchus","","gi|985566742|dbj|LC069677.1|, gi|985563312|dbj|LC091995.1|",99.387,"CACCGCGGTTATACGAGAGGCCCAAGTTGACAGACATCGGCGTAAAGAGTGGTTAAGTTAAAATTCACACTAAAGCCGAACGTCCTCCAGGCTGTTATACGCACCCGAAGATAAGAAGTTCAATCACGAAAGTGGCTTTATTTAATCTGAGCCCACGAAAGCT","2025-08-12"
"130","799d27b68766a090d510b9a716c918dec29e7d9f","Gobiesox maeandricus",1,"Gobiesox maeandricus","0","63828",63828,"Eukaryota","Chordata","Actinopteri","Blenniiformes","Gobiesocidae","Gobiesox","Gobiesox maeandricus","gi|985563355|dbj|LC092038.1|",100,"CACCGCGGTTATACGAGAGACTCAAGTTGACAACCCATCGGCGTAAAAAGTGGTTAATTATATATTATTACTAAAGTTGAACACCCTCAAAGCTGTTATACGTTCTCGAGGGTAAGAAGGCCCCCTACGAAAGTGACTTTACAATACTGACGCCACTAAAGCT","2025-08-12"
"131","7c7549b78495a914d93728d737a711422a593671","Anoplarchus",3,"Anoplarchus purpurescens, Anoplarchus purpurescens;Anoplarchus insignis, Leptoclinus maculatus, Anisarchus medius, Alectrias alectrolophus, Ernogrammus hexagrammus, Alectrias benjamini, Anisarchus macrops, Eumesogrammus praecisus, Opisthocentrus ocellatus, Ulvaria subbifurcata, Stichaeus punctatus, Xiphister atropurpureus, Zaprora silenus, Chirolophis japonicus, Opisthocentrus tenuis, Stichaeopsis nana, Askoldia variegata, Cryptacanthodes giganteus, Xiphister mucosus, Poroclinus rothrocki, Chirolophis wui, Kasatkia memorabilis, Dictyosoma rubrimaculatum, Chirolophis ascanii","0, 6, 7, 8","320623 320623 1225888",320622,"Eukaryota","Chordata","Actinopteri","Perciformes","Stichaeidae","Anoplarchus","","gi|985566742|dbj|LC069677.1|, gi|985563312|dbj|LC091995.1|",100,"CACCGCGGTTATACGAGAGGCCCAAGTTGACAGACATCGGCGTAAAGAGTGGTTAAGTTAAAATTCACACTAAAGCCGAACGTCCTCCAGGCTGTTATACGCACCCGAAGATAAGAAGTTCAATCACGAAAGTGGCTTTATTTAATCTGAACCCACGAAAGCT","2025-08-12"
"132","7ca707a431a16bdbdacc2b41e18ac4d30d0c4d7a","Artedius lateralis",2,"Artedius lateralis, Artedius harringtoni, Artedius fenestralis","2, 10, 13","322683",322683,"Eukaryota","Chordata","Actinopteri","Perciformes","Cottidae","Artedius","Artedius lateralis","gi|985563239|dbj|LC091922.1|",98.773,"CACCGCGGTTATACGAATGGCCCAAGTTGACAGATACTCGGCGTAAAACGTGGCTAAGCTACACACTCCCACTAAAGCCAAACACCTTCAAAGCTGTGATACGCAATCGAAGGCAGGAAGTCCCACCACGAAAGTGGCTTTACCTAATCTGAGTCCACGAAAG","2025-08-12"
"133","7e47685acabeca1d9f05556efbb6b41f5fe142fe","Phoca vitulina",1,"Phoca vitulina, Pusa hispida, Halichoerus grypus grypus, Halichoerus grypus, Phoca groenlandica","0, 1, 2, 4, 6","9720",9720,"Eukaryota","Chordata","Mammalia","Carnivora","Phocidae","Phoca","Phoca vitulina","gi|1878254150|gb|MT410883.1|, gi|115345039|emb|AM181032.1|",100,"CACCGCGGTCATACGATTAACCCAAACTAATAGGCCCTCGGCGTAAAGCGTGTTAAAGATCAACCCACACTAAAGCTAAAACCTAACCAAGCCGTAAAAAGCTACCGTTAACATAAAATAGACCACGAAAGTGACTTTACTAATTCTGACTGCACGATAGCTA","2025-08-12"
"134","7e9a56f26d0050955e064760dfedbf48c3b22608","Microstomus pacificus",1,"Microstomus pacificus, Glyptocephalus zachirus, Myzopsetta proboscidea, Glyptocephalus stelleri, Glyptocephalus zachirus;Glyptocephalus stelleri, Platichthys stellatus, Myzopsetta ferruginea, Microstomus kitt, Platichthys flesus, Liopsetta glacialis, Platichthys stellatus x Verasper variegatus, Platichthys stellatus x (Kareius bicoloratus x Platichthys stellatus), Kareius bicoloratus x Platichthys stellatus, Microstomus achne, Platichthys stellatus;Liopsetta pinnifasciata;Platichthys stellatus x Parophrys vetulus, Kareius bicoloratus, Pleuronectes quadrituberculatus, Limanda aspera, Hippoglossoides elassodon;Acanthopsetta nadeshnyi;Hippoglossoides robustus, Parophrys vetulus, Glyptocephalus cynoglossus, Psettichthys melanostictus, Isopsetta isolepis, Pseudopleuronectes americanus, Hippoglossoides platessoides","0, 1, 2, 3","89058",89058,"Eukaryota","Chordata","Actinopteri","Pleuronectiformes","Pleuronectidae","Microstomus","Microstomus pacificus","gi|1018242350|dbj|LC145944.1|, gi|1018242338|dbj|LC145932.1|, gi|22532240|gb|AF488480.1|",100,"CACCGCGGTTATACGAGAGGCCCAAGTTGACAAACAACGGCGTAAAGAGTGGTTAGGGGATTTACTAAACTAGAGCTGAACGCTTTCAAAGCTGTTATACGCACCCGAAAGTATGAAACCCAATTACGAAAGTAGCTCTACCTGTCCTGAACCCACGAAAGCT","2025-08-12"
"135","7ec20b2cfa1f7c85fdf786273d75b21522032948","Gadus chalcogrammus",3,"Gadus chalcogrammus, Gadus finnmarchicus, Gadus macrocephalus, Boreogadus saida, Gadus ogac","0, 1, 2, 3","1042646",1042646,"Eukaryota","Chordata","Actinopteri","Gadiformes","Gadidae","Gadus","Gadus chalcogrammus","gi|1783586443|gb|MH035601.1|, gi|821091571|gb|KP644357.1|",100,"CACCGCGGTTATACGAGAGGCCCAAATTGATGAAAAACGGCGTAAAGCGTGGTTAAGAAAAAGAGAGAAAATATGGCCGAACAGCTTCAAAGCAGTTATACGCATCCGAAGTCACGAAGAACAATCACGAAAGTTGCCCTAAAACCTCCGATTCCACGAAAGC","2025-08-12"
"136","8138d6d1527ab14e70f5b5b5fbe2af0911a1a02e","Clupea pallasii",38,"Clupea pallasii","1, 2, 0","30724",30724,"Eukaryota","Chordata","Actinopteri","Clupeiformes","Clupeidae","Clupea","Clupea pallasii","gi|117671448|gb|DQ912047.1|",100,"CACCGCGGTTATACGAGAGGCCCTAGTTGATATACTCGGCGTAAAGAGTGGTTATGGAAAACAAGCACTAAAGCCAAAGAGCCCTCAGGCCGTTATACGCACCCGGGGCCTCGAACCACTATCACGAAAGTAGCTTTACCCTCGCCCACCAGAACCCACGAGA","2025-08-12"
"137","82955bbe79e2750ad53920f8f84f217dfea834a1","Anarrhichthys ocellatus",1,"Anarrhichthys ocellatus, Anisarchus medius, Cryptacanthodes maculatus, Neozoarces steindachneri, Anisarchus macrops, Gymnoclinus cristulatus, Anarhichas lupus, Eumesogrammus praecisus, Anarhichas denticulatus, Opisthocentrus tenuis, Stichaeopsis nana, Askoldia variegata, Leptoclinus maculatus, Opisthocentrus ocellatus, Anarhichas orientalis, Cryptacanthodes giganteus, Poroclinus rothrocki, Ronquilus jordani, Kasatkia memorabilis, Stichaeopsis nevelskoi, Anarhichas minor","0, 5, 4, 6","433405",433405,"Eukaryota","Chordata","Actinopteri","Perciformes","Anarhichadidae","Anarrhichthys","Anarrhichthys ocellatus","gi|1747452161|ref|NC_044782.1|, gi|985563341|dbj|LC092024.1|",100,"CACCGCGGTTATACGAGAGGCCCAAGTTGAAAGACCACGGCGTAAAGAGTGGTTAAGTTAAAATTTACACTAAAGCCGAACATCCTCACGGCTGTTATACGCACCCGAAGATAAGAAGTTCAACCACGAAGGTGGCTTTATTTAATCTGAACCCACGAAAGCT","2025-08-12"
"138","830a9362056d11bea72f74b0210762e4d45e77c8","Oncorhynchus nerka",1,"Oncorhynchus nerka, Oncorhynchus keta;Oncorhynchus nerka, Oncorhynchus keta, Oncorhynchus kawamurae, Oncorhynchus mykiss, Oncorhynchus mykiss nelsoni, Oncorhynchus chrysogaster, Oncorhynchus gorbuscha, Oncorhynchus gilae, Oncorhynchus mykiss gairdneri, Oncorhynchus clarkii lewisi, Oncorhynchus mykiss irideus, Oncorhynchus mykiss newberrii, Oncorhynchus gilae apache","0, 1","8023",8023,"Eukaryota","Chordata","Actinopteri","Salmoniformes","Salmonidae","Oncorhynchus","Oncorhynchus nerka","gi|2797147440|dbj|LC835958.1|, gi|1293099582|dbj|LC340053.1|, gi|2305126655|gb|OL806600.1|",100,"CACCGCGGTTATACGAGAGGCCCTAGTTGATAACTACCGGCGTAAAGAGTGGTTATGGAAAATATTTAATAAAGCCGAACACCCCCTCAGCCGTCATACGCACCTGGGAGCACGAAGACCTACTGCGAAAGCAGCTTTAATTATGCCTGACCCCACGACAGCT","2025-08-12"
"139","8330c76dc36fd6a69347d56edbceb6e8df6a643f","Anoplarchus",4,"Anoplarchus purpurescens, Anoplarchus purpurescens;Anoplarchus insignis, Leptoclinus maculatus, Anisarchus medius, Alectrias alectrolophus, Ernogrammus hexagrammus, Alectrias benjamini, Anisarchus macrops, Eumesogrammus praecisus, Opisthocentrus ocellatus, Ulvaria subbifurcata, Stichaeus punctatus, Xiphister atropurpureus, Zaprora silenus, Chirolophis japonicus, Opisthocentrus tenuis, Stichaeopsis nana, Askoldia variegata, Cryptacanthodes giganteus, Xiphister mucosus, Poroclinus rothrocki, Chirolophis wui, Kasatkia memorabilis, Dictyosoma rubrimaculatum, Chirolophis ascanii","1, 7, 8, 9","320623 320623 1225888",320622,"Eukaryota","Chordata","Actinopteri","Perciformes","Stichaeidae","Anoplarchus","","gi|985566742|dbj|LC069677.1|, gi|985563312|dbj|LC091995.1|",99.387,"CACCGCGGTTATACGAGAGGCCCAAGTTGACAGACATCGGCGTAAAGAGTGGTTAAGTTAAAATTCACACTAAAGCCGAATGTCCTCCAGGCTGTTATACGCACCCGAAGATAAGAAGTTCAATCACGAAAGTGGCTTTATTTAATCTGAACCCACGAAAGCT","2025-08-12"
"140","836d1dd48586942b8d4038173ba3e9a651a00377","Clupea pallasii",39,"Clupea pallasii, Sprattus muelleri, Sprattus antipodum, Ethmidium maculatum","1, 2, 11, 12, 13","30724",30724,"Eukaryota","Chordata","Actinopteri","Clupeiformes","Clupeidae","Clupea","Clupea pallasii","gi|985566912|dbj|LC091579.1|",99.387,"CACCGCGGTTATACGAGAGACCCTAGTTGATATGCTCGGCGTAAAGAGTGGTTATGGAAAACAAGCACTAGAGCCAAAGAGCCCTCAGGCCGTTATACGCACCCGGGGCCTCGAACCACTATCACGAAAGTAGCTTTACCCTCGCCCACCAGAACCCACGAGA","2025-08-12"
"141","83acfe774d7c337e335b02d9e421689d83bc3f79","Apodichthys flavidus",5,"Apodichthys flavidus, Bryozoichthys lysimus, Chirolophis decoratus;Chirolophis nugator, Eumesogrammus praecisus, Opisthocentrus ocellatus, Pholidapus dybowskii, Xenolumpenus longipterus, Pholis crassispina, Ulvaria subbifurcata, Askoldia variegata, Anisarchus medius, Chirolophis japonicus, Pholis crassispina;Pholis picta;Pholis clemensi, Poroclinus rothrocki, Lumpenella longirostris, Chirolophis wui, Stichaeopsis nevelskoi, Pholis picta, Alectrias benjamini, Anisarchus macrops, Chirolophis ascanii, Leptoclinus maculatus, Opisthocentrus zonope, Opisthocentrus tenuis, Stichaeopsis nana, Pholis nebulosa","1, 3, 4, 5, 6, 7","57779",57779,"Eukaryota","Chordata","Actinopteri","Perciformes","Pholidae","Apodichthys","Apodichthys flavidus","gi|985563339|dbj|LC092022.1|, gi|2314982008|ref|NC_066931.1|",99.387,"CACCGCGGTTATACGAGAGGCCCAAGTTGACAGACATCGGCGTAAAGAGTGGTTAAGTTGAATTTGTACTAAAGCCGAACACCCTCAAGGCTGTTATACGCACCCGAAGATAAGAAGTTCGACCACGAAGGTGGCTTTATTTAGTCTGAACCCACGAAAGCTG","2025-08-12"
"142","8414760d41f1b195c189bf4f6a25b6ed910e5eef","Rhamphocottus richardsonii",1,"Rhamphocottus richardsonii, Pleurogrammus monopterygius, Artediellus sp. HUMZ:166735, Hexagrammos agrammus, Hexagrammos stelleri, Phasmatocottus ctenopterygius, Artediellus neyelovi, Hexagrammos octogrammus;Hexagrammos agrammus;Hexagrammos lagocephalus;Hexagrammos stelleri, Hexagrammos lagocephalus, Hexagrammos octogrammus, Artediellus pacificus, Artediellus scaber, Hexagrammos otakii, Radulinus asprellus, Radulinus boleoides, Radulinopsis taranetzi, Artediellus dydymovi, Scorpaenichthys marmoratus, Artediellus uncinatus, Myoxocephalus brandtii, Microcottus sellaris, Myoxocephalus quadricornis, Taurocottus bergii, Gymnocanthus galeatus, Myoxocephalus scorpius","0, 8, 9, 10, 11, 12","283636",283636,"Eukaryota","Chordata","Actinopteri","Perciformes","Rhamphocottidae","Rhamphocottus","Rhamphocottus richardsonii","gi|985563223|dbj|LC091906.1|, gi|669175238|gb|KM057985.1|",100,"CACCGCGGTTATACGAGAGGCCCAAGTTGATCAACACCGGCGTAAAGAGTGGTTAAGTTAAACCTCACATTAAAGTCAAACATCTTCAAGGCTGTTATACGCAACCGAAGGCAGGAAGTTCAACCACGAAAGTGGCTTTATTTATTCTGAATCCACGAAAGCT","2025-08-12"
